2004-12-20 04:43:47.374271 00:00:00:00:00:00 > 00:00:00:00:00:00, ethertype IPv4 (0x0800), length 98: 192.168.3.3.710 > 192.168.3.3.1010: UDP, length 56
2004-12-20 04:43:47.374496 00:00:00:00:00:00 > 00:00:00:00:00:00, ethertype IPv4 (0x0800), length 70: 192.168.3.3.1010 > 192.168.3.3.710: UDP, length 28
2004-12-20 04:43:53.559309 00:00:00:00:00:00 > 00:00:00:00:00:00, ethertype IPv4 (0x0800), length 74: 127.0.0.1.57826 > 127.0.0.1.57825: Flags [S], seq 2979169187, win 32767, options [mss 16396,sackOK,TS val 547839687 ecr 0,nop,wscale 0], length 0
2004-12-20 04:43:53.559374 00:00:00:00:00:00 > 00:00:00:00:00:00, ethertype IPv4 (0x0800), length 74: 127.0.0.1.57825 > 127.0.0.1.57826: Flags [S.], seq 2988196175, ack 2979169188, win 32767, options [mss 16396,sackOK,TS val 547839687 ecr 547839687,nop,wscale 0], length 0
2004-12-20 04:43:53.559414 00:00:00:00:00:00 > 00:00:00:00:00:00, ethertype IPv4 (0x0800), length 66: 127.0.0.1.57826 > 127.0.0.1.57825: Flags [.], ack 1, win 32767, options [nop,nop,TS val 547839687 ecr 547839687], length 0
2004-12-20 04:43:53.559476 00:00:00:00:00:00 > 00:00:00:00:00:00, ethertype IPv4 (0x0800), length 66: 127.0.0.1.57826 > 127.0.0.1.57825: Flags [F.], seq 1, ack 1, win 32767, options [nop,nop,TS val 547839687 ecr 547839687], length 0
2004-12-20 04:43:53.559507 00:00:00:00:00:00 > 00:00:00:00:00:00, ethertype IPv4 (0x0800), length 66: 127.0.0.1.57825 > 127.0.0.1.57826: Flags [F.], seq 1, ack 2, win 32767, options [nop,nop,TS val 547839687 ecr 547839687], length 0
2004-12-20 04:43:53.559517 00:00:00:00:00:00 > 00:00:00:00:00:00, ethertype IPv4 (0x0800), length 66: 127.0.0.1.57826 > 127.0.0.1.57825: Flags [.], ack 2, win 32767, options [nop,nop,TS val 547839687 ecr 547839687], length 0
2004-12-20 04:43:53.560476 00:00:00:00:00:00 > 00:00:00:00:00:00, ethertype IPv4 (0x0800), length 74: 127.0.0.1.57827 > 127.0.0.1.5432: Flags [S], seq 2980652111, win 32767, options [mss 16396,sackOK,TS val 547839687 ecr 0,nop,wscale 0], length 0
2004-12-20 04:43:53.560510 00:00:00:00:00:00 > 00:00:00:00:00:00, ethertype IPv4 (0x0800), length 74: 127.0.0.1.5432 > 127.0.0.1.57827: Flags [S.], seq 2979300139, ack 2980652112, win 32767, options [mss 16396,sackOK,TS val 547839687 ecr 547839687,nop,wscale 0], length 0
2004-12-20 04:43:53.560532 00:00:00:00:00:00 > 00:00:00:00:00:00, ethertype IPv4 (0x0800), length 66: 127.0.0.1.57827 > 127.0.0.1.5432: Flags [.], ack 1, win 32767, options [nop,nop,TS val 547839687 ecr 547839687], length 0
2004-12-20 04:43:53.575208 00:00:00:00:00:00 > 00:00:00:00:00:00, ethertype IPv4 (0x0800), length 157: 127.0.0.1.57827 > 127.0.0.1.5432: Flags [P.], seq 1:92, ack 1, win 32767, options [nop,nop,TS val 547839689 ecr 547839687], length 91
2004-12-20 04:43:53.575398 00:00:00:00:00:00 > 00:00:00:00:00:00, ethertype IPv4 (0x0800), length 66: 127.0.0.1.5432 > 127.0.0.1.57827: Flags [.], ack 92, win 32767, options [nop,nop,TS val 547839689 ecr 547839689], length 0
2004-12-20 04:43:53.579632 00:00:00:00:00:00 > 00:00:00:00:00:00, ethertype IPv4 (0x0800), length 66: 127.0.0.1.34651 > 127.0.0.1.34651: UDP, length 24
2004-12-20 04:43:53.579723 00:00:00:00:00:00 > 00:00:00:00:00:00, ethertype IPv4 (0x0800), length 418: 127.0.0.1.34651 > 127.0.0.1.34651: UDP, length 376
2004-12-20 04:43:53.579784 00:00:00:00:00:00 > 00:00:00:00:00:00, ethertype IPv4 (0x0800), length 226: 127.0.0.1.5432 > 127.0.0.1.57827: Flags [P.], seq 1:161, ack 92, win 32767, options [nop,nop,TS val 547839689 ecr 547839689], length 160
2004-12-20 04:43:53.579973 00:00:00:00:00:00 > 00:00:00:00:00:00, ethertype IPv4 (0x0800), length 66: 127.0.0.1.57827 > 127.0.0.1.5432: Flags [.], ack 161, win 32767, options [nop,nop,TS val 547839689 ecr 547839689], length 0
2004-12-20 04:43:53.662832 00:00:00:00:00:00 > 00:00:00:00:00:00, ethertype IPv4 (0x0800), length 71: 127.0.0.1.57827 > 127.0.0.1.5432: Flags [P.], seq 92:97, ack 161, win 32767, options [nop,nop,TS val 547839697 ecr 547839689], length 5
2004-12-20 04:43:53.663262 00:00:00:00:00:00 > 00:00:00:00:00:00, ethertype IPv4 (0x0800), length 66: 127.0.0.1.57827 > 127.0.0.1.5432: Flags [F.], seq 97, ack 161, win 32767, options [nop,nop,TS val 547839697 ecr 547839689], length 0
2004-12-20 04:43:53.664311 00:00:00:00:00:00 > 00:00:00:00:00:00, ethertype IPv4 (0x0800), length 74: 127.0.0.1.57828 > 127.0.0.1.5432: Flags [S], seq 2975260768, win 32767, options [mss 16396,sackOK,TS val 547839697 ecr 0,nop,wscale 0], length 0
2004-12-20 04:43:53.664354 00:00:00:00:00:00 > 00:00:00:00:00:00, ethertype IPv4 (0x0800), length 74: 127.0.0.1.5432 > 127.0.0.1.57828: Flags [S.], seq 2988457177, ack 2975260769, win 32767, options [mss 16396,sackOK,TS val 547839697 ecr 547839697,nop,wscale 0], length 0
2004-12-20 04:43:53.664386 00:00:00:00:00:00 > 00:00:00:00:00:00, ethertype IPv4 (0x0800), length 66: 127.0.0.1.57828 > 127.0.0.1.5432: Flags [.], ack 1, win 32767, options [nop,nop,TS val 547839697 ecr 547839697], length 0
2004-12-20 04:43:53.664625 00:00:00:00:00:00 > 00:00:00:00:00:00, ethertype IPv4 (0x0800), length 66: 127.0.0.1.5432 > 127.0.0.1.57827: Flags [F.], seq 161, ack 98, win 32767, options [nop,nop,TS val 547839698 ecr 547839697], length 0
2004-12-20 04:43:53.664679 00:00:00:00:00:00 > 00:00:00:00:00:00, ethertype IPv4 (0x0800), length 66: 127.0.0.1.57827 > 127.0.0.1.5432: Flags [.], ack 162, win 32767, options [nop,nop,TS val 547839698 ecr 547839698], length 0
2004-12-20 04:43:53.665252 00:00:00:00:00:00 > 00:00:00:00:00:00, ethertype IPv4 (0x0800), length 157: 127.0.0.1.57828 > 127.0.0.1.5432: Flags [P.], seq 1:92, ack 1, win 32767, options [nop,nop,TS val 547839698 ecr 547839697], length 91
2004-12-20 04:43:53.665299 00:00:00:00:00:00 > 00:00:00:00:00:00, ethertype IPv4 (0x0800), length 66: 127.0.0.1.5432 > 127.0.0.1.57828: Flags [.], ack 92, win 32767, options [nop,nop,TS val 547839698 ecr 547839698], length 0
2004-12-20 04:43:53.665334 00:00:00:00:00:00 > 00:00:00:00:00:00, ethertype IPv4 (0x0800), length 66: 127.0.0.1.34651 > 127.0.0.1.34651: UDP, length 24
2004-12-20 04:43:53.670538 00:00:00:00:00:00 > 00:00:00:00:00:00, ethertype IPv4 (0x0800), length 66: 127.0.0.1.34651 > 127.0.0.1.34651: UDP, length 24
2004-12-20 04:43:53.670764 00:00:00:00:00:00 > 00:00:00:00:00:00, ethertype IPv4 (0x0800), length 418: 127.0.0.1.34651 > 127.0.0.1.34651: UDP, length 376
2004-12-20 04:43:53.670850 00:00:00:00:00:00 > 00:00:00:00:00:00, ethertype IPv4 (0x0800), length 226: 127.0.0.1.5432 > 127.0.0.1.57828: Flags [P.], seq 1:161, ack 92, win 32767, options [nop,nop,TS val 547839698 ecr 547839698], length 160
2004-12-20 04:43:53.671012 00:00:00:00:00:00 > 00:00:00:00:00:00, ethertype IPv4 (0x0800), length 66: 127.0.0.1.57828 > 127.0.0.1.5432: Flags [.], ack 161, win 32767, options [nop,nop,TS val 547839698 ecr 547839698], length 0
2004-12-20 04:43:53.671972 00:00:00:00:00:00 > 00:00:00:00:00:00, ethertype IPv4 (0x0800), length 71: 127.0.0.1.57828 > 127.0.0.1.5432: Flags [P.], seq 92:97, ack 161, win 32767, options [nop,nop,TS val 547839698 ecr 547839698], length 5
2004-12-20 04:43:53.672271 00:00:00:00:00:00 > 00:00:00:00:00:00, ethertype IPv4 (0x0800), length 66: 127.0.0.1.57828 > 127.0.0.1.5432: Flags [F.], seq 97, ack 161, win 32767, options [nop,nop,TS val 547839698 ecr 547839698], length 0
2004-12-20 04:43:53.673523 00:00:00:00:00:00 > 00:00:00:00:00:00, ethertype IPv4 (0x0800), length 66: 127.0.0.1.5432 > 127.0.0.1.57828: Flags [F.], seq 161, ack 98, win 32767, options [nop,nop,TS val 547839698 ecr 547839698], length 0
2004-12-20 04:43:53.673547 00:00:00:00:00:00 > 00:00:00:00:00:00, ethertype IPv4 (0x0800), length 74: 127.0.0.1.57829 > 127.0.0.1.5432: Flags [S], seq 2984107626, win 32767, options [mss 16396,sackOK,TS val 547839698 ecr 0,nop,wscale 0], length 0
2004-12-20 04:43:53.673601 00:00:00:00:00:00 > 00:00:00:00:00:00, ethertype IPv4 (0x0800), length 74: 127.0.0.1.5432 > 127.0.0.1.57829: Flags [S.], seq 2978636039, ack 2984107627, win 32767, options [mss 16396,sackOK,TS val 547839698 ecr 547839698,nop,wscale 0], length 0
2004-12-20 04:43:53.673589 00:00:00:00:00:00 > 00:00:00:00:00:00, ethertype IPv4 (0x0800), length 66: 127.0.0.1.57828 > 127.0.0.1.5432: Flags [.], ack 162, win 32767, options [nop,nop,TS val 547839698 ecr 547839698], length 0
2004-12-20 04:43:53.673646 00:00:00:00:00:00 > 00:00:00:00:00:00, ethertype IPv4 (0x0800), length 66: 127.0.0.1.57829 > 127.0.0.1.5432: Flags [.], ack 1, win 32767, options [nop,nop,TS val 547839698 ecr 547839698], length 0
2004-12-20 04:43:53.673836 00:00:00:00:00:00 > 00:00:00:00:00:00, ethertype IPv4 (0x0800), length 66: 127.0.0.1.34651 > 127.0.0.1.34651: UDP, length 24
2004-12-20 04:43:53.674856 00:00:00:00:00:00 > 00:00:00:00:00:00, ethertype IPv4 (0x0800), length 157: 127.0.0.1.57829 > 127.0.0.1.5432: Flags [P.], seq 1:92, ack 1, win 32767, options [nop,nop,TS val 547839699 ecr 547839698], length 91
2004-12-20 04:43:53.674898 00:00:00:00:00:00 > 00:00:00:00:00:00, ethertype IPv4 (0x0800), length 66: 127.0.0.1.5432 > 127.0.0.1.57829: Flags [.], ack 92, win 32767, options [nop,nop,TS val 547839699 ecr 547839699], length 0
2004-12-20 04:43:53.679401 00:00:00:00:00:00 > 00:00:00:00:00:00, ethertype IPv4 (0x0800), length 66: 127.0.0.1.34651 > 127.0.0.1.34651: UDP, length 24
2004-12-20 04:43:53.679476 00:00:00:00:00:00 > 00:00:00:00:00:00, ethertype IPv4 (0x0800), length 418: 127.0.0.1.34651 > 127.0.0.1.34651: UDP, length 376
2004-12-20 04:43:53.679540 00:00:00:00:00:00 > 00:00:00:00:00:00, ethertype IPv4 (0x0800), length 226: 127.0.0.1.5432 > 127.0.0.1.57829: Flags [P.], seq 1:161, ack 92, win 32767, options [nop,nop,TS val 547839699 ecr 547839699], length 160
2004-12-20 04:43:53.679654 00:00:00:00:00:00 > 00:00:00:00:00:00, ethertype IPv4 (0x0800), length 66: 127.0.0.1.57829 > 127.0.0.1.5432: Flags [.], ack 161, win 32767, options [nop,nop,TS val 547839699 ecr 547839699], length 0
2004-12-20 04:43:53.736309 00:00:00:00:00:00 > 00:00:00:00:00:00, ethertype IPv4 (0x0800), length 136: 127.0.0.1.57829 > 127.0.0.1.5432: Flags [P.], seq 92:162, ack 161, win 32767, options [nop,nop,TS val 547839705 ecr 547839699], length 70
2004-12-20 04:43:53.737415 00:00:00:00:00:00 > 00:00:00:00:00:00, ethertype IPv4 (0x0800), length 170: 127.0.0.1.5432 > 127.0.0.1.57829: Flags [P.], seq 161:265, ack 162, win 32767, options [nop,nop,TS val 547839705 ecr 547839705], length 104
2004-12-20 04:43:53.737510 00:00:00:00:00:00 > 00:00:00:00:00:00, ethertype IPv4 (0x0800), length 66: 127.0.0.1.57829 > 127.0.0.1.5432: Flags [.], ack 265, win 32767, options [nop,nop,TS val 547839705 ecr 547839705], length 0
2004-12-20 04:43:53.737678 00:00:00:00:00:00 > 00:00:00:00:00:00, ethertype IPv4 (0x0800), length 486: 127.0.0.1.34651 > 127.0.0.1.34651: UDP, length 444
2004-12-20 04:43:53.737778 00:00:00:00:00:00 > 00:00:00:00:00:00, ethertype IPv4 (0x0800), length 72: 127.0.0.1.5432 > 127.0.0.1.57829: Flags [P.], seq 265:271, ack 162, win 32767, options [nop,nop,TS val 547839705 ecr 547839705], length 6
2004-12-20 04:43:53.737799 00:00:00:00:00:00 > 00:00:00:00:00:00, ethertype IPv4 (0x0800), length 66: 127.0.0.1.57829 > 127.0.0.1.5432: Flags [.], ack 271, win 32767, options [nop,nop,TS val 547839705 ecr 547839705], length 0
2004-12-20 04:43:53.742730 00:00:00:00:00:00 > 00:00:00:00:00:00, ethertype IPv4 (0x0800), length 164: 127.0.0.1.57829 > 127.0.0.1.5432: Flags [P.], seq 162:260, ack 271, win 32767, options [nop,nop,TS val 547839705 ecr 547839705], length 98
2004-12-20 04:43:53.774588 00:00:00:00:00:00 > 00:00:00:00:00:00, ethertype IPv4 (0x0800), length 66: 127.0.0.1.5432 > 127.0.0.1.57829: Flags [.], ack 260, win 32767, options [nop,nop,TS val 547839709 ecr 547839705], length 0
2004-12-20 04:43:54.279638 00:00:00:00:00:00 > 00:00:00:00:00:00, ethertype IPv4 (0x0800), length 1030: 127.0.0.1.34651 > 127.0.0.1.34651: UDP, length 988
2004-12-20 04:43:54.279756 00:00:00:00:00:00 > 00:00:00:00:00:00, ethertype IPv4 (0x0800), length 1030: 127.0.0.1.34651 > 127.0.0.1.34651: UDP, length 988
2004-12-20 04:43:54.279789 00:00:00:00:00:00 > 00:00:00:00:00:00, ethertype IPv4 (0x0800), length 486: 127.0.0.1.34651 > 127.0.0.1.34651: UDP, length 444
2004-12-20 04:43:54.279843 00:00:00:00:00:00 > 00:00:00:00:00:00, ethertype IPv4 (0x0800), length 105: 127.0.0.1.5432 > 127.0.0.1.57829: Flags [P.], seq 271:310, ack 260, win 32767, options [nop,nop,TS val 547839759 ecr 547839705], length 39
2004-12-20 04:43:54.282784 00:00:00:00:00:00 > 00:00:00:00:00:00, ethertype IPv4 (0x0800), length 136: 127.0.0.1.57829 > 127.0.0.1.5432: Flags [P.], seq 260:330, ack 310, win 32767, options [nop,nop,TS val 547839759 ecr 547839759], length 70
2004-12-20 04:43:54.282920 00:00:00:00:00:00 > 00:00:00:00:00:00, ethertype IPv4 (0x0800), length 66: 127.0.0.1.5432 > 127.0.0.1.57829: Flags [.], ack 330, win 32767, options [nop,nop,TS val 547839759 ecr 547839759], length 0
2004-12-20 04:43:54.283637 00:00:00:00:00:00 > 00:00:00:00:00:00, ethertype IPv4 (0x0800), length 170: 127.0.0.1.5432 > 127.0.0.1.57829: Flags [P.], seq 310:414, ack 330, win 32767, options [nop,nop,TS val 547839759 ecr 547839759], length 104
2004-12-20 04:43:54.283861 00:00:00:00:00:00 > 00:00:00:00:00:00, ethertype IPv4 (0x0800), length 214: 127.0.0.1.34651 > 127.0.0.1.34651: UDP, length 172
2004-12-20 04:43:54.283892 00:00:00:00:00:00 > 00:00:00:00:00:00, ethertype IPv4 (0x0800), length 72: 127.0.0.1.5432 > 127.0.0.1.57829: Flags [P.], seq 414:420, ack 330, win 32767, options [nop,nop,TS val 547839759 ecr 547839759], length 6
2004-12-20 04:43:54.284578 00:00:00:00:00:00 > 00:00:00:00:00:00, ethertype IPv4 (0x0800), length 167: 127.0.0.1.57829 > 127.0.0.1.5432: Flags [P.], seq 330:431, ack 420, win 32767, options [nop,nop,TS val 547839759 ecr 547839759], length 101
2004-12-20 04:43:54.324711 00:00:00:00:00:00 > 00:00:00:00:00:00, ethertype IPv4 (0x0800), length 66: 127.0.0.1.5432 > 127.0.0.1.57829: Flags [.], ack 431, win 32767, options [nop,nop,TS val 547839764 ecr 547839759], length 0
2004-12-20 04:43:54.332329 00:00:00:00:00:00 > 00:00:00:00:00:00, ethertype IPv4 (0x0800), length 1030: 127.0.0.1.34651 > 127.0.0.1.34651: UDP, length 988
2004-12-20 04:43:54.332370 00:00:00:00:00:00 > 00:00:00:00:00:00, ethertype IPv4 (0x0800), length 418: 127.0.0.1.34651 > 127.0.0.1.34651: UDP, length 376
2004-12-20 04:43:54.332415 00:00:00:00:00:00 > 00:00:00:00:00:00, ethertype IPv4 (0x0800), length 105: 127.0.0.1.5432 > 127.0.0.1.57829: Flags [P.], seq 420:459, ack 431, win 32767, options [nop,nop,TS val 547839764 ecr 547839759], length 39
2004-12-20 04:43:54.332788 00:00:00:00:00:00 > 00:00:00:00:00:00, ethertype IPv4 (0x0800), length 71: 127.0.0.1.57829 > 127.0.0.1.5432: Flags [P.], seq 431:436, ack 459, win 32767, options [nop,nop,TS val 547839764 ecr 547839764], length 5
2004-12-20 04:43:54.332820 00:00:00:00:00:00 > 00:00:00:00:00:00, ethertype IPv4 (0x0800), length 66: 127.0.0.1.5432 > 127.0.0.1.57829: Flags [.], ack 436, win 32767, options [nop,nop,TS val 547839764 ecr 547839764], length 0
2004-12-20 04:43:54.333095 00:00:00:00:00:00 > 00:00:00:00:00:00, ethertype IPv4 (0x0800), length 66: 127.0.0.1.57829 > 127.0.0.1.5432: Flags [F.], seq 436, ack 459, win 32767, options [nop,nop,TS val 547839764 ecr 547839764], length 0
2004-12-20 04:43:54.334265 00:00:00:00:00:00 > 00:00:00:00:00:00, ethertype IPv4 (0x0800), length 74: 127.0.0.1.57830 > 127.0.0.1.5432: Flags [S], seq 2978711475, win 32767, options [mss 16396,sackOK,TS val 547839764 ecr 0,nop,wscale 0], length 0
2004-12-20 04:43:54.334309 00:00:00:00:00:00 > 00:00:00:00:00:00, ethertype IPv4 (0x0800), length 74: 127.0.0.1.5432 > 127.0.0.1.57830: Flags [S.], seq 2977794490, ack 2978711476, win 32767, options [mss 16396,sackOK,TS val 547839764 ecr 547839764,nop,wscale 0], length 0
2004-12-20 04:43:54.334339 00:00:00:00:00:00 > 00:00:00:00:00:00, ethertype IPv4 (0x0800), length 66: 127.0.0.1.57830 > 127.0.0.1.5432: Flags [.], ack 1, win 32767, options [nop,nop,TS val 547839764 ecr 547839764], length 0
2004-12-20 04:43:54.334466 00:00:00:00:00:00 > 00:00:00:00:00:00, ethertype IPv4 (0x0800), length 66: 127.0.0.1.5432 > 127.0.0.1.57829: Flags [F.], seq 459, ack 437, win 32767, options [nop,nop,TS val 547839764 ecr 547839764], length 0
2004-12-20 04:43:54.334508 00:00:00:00:00:00 > 00:00:00:00:00:00, ethertype IPv4 (0x0800), length 66: 127.0.0.1.57829 > 127.0.0.1.5432: Flags [.], ack 460, win 32767, options [nop,nop,TS val 547839764 ecr 547839764], length 0
2004-12-20 04:43:54.334835 00:00:00:00:00:00 > 00:00:00:00:00:00, ethertype IPv4 (0x0800), length 66: 127.0.0.1.34651 > 127.0.0.1.34651: UDP, length 24
2004-12-20 04:43:54.341448 00:00:00:00:00:00 > 00:00:00:00:00:00, ethertype IPv4 (0x0800), length 157: 127.0.0.1.57830 > 127.0.0.1.5432: Flags [P.], seq 1:92, ack 1, win 32767, options [nop,nop,TS val 547839765 ecr 547839764], length 91
2004-12-20 04:43:54.341529 00:00:00:00:00:00 > 00:00:00:00:00:00, ethertype IPv4 (0x0800), length 66: 127.0.0.1.5432 > 127.0.0.1.57830: Flags [.], ack 92, win 32767, options [nop,nop,TS val 547839765 ecr 547839765], length 0
2004-12-20 04:43:54.345782 00:00:00:00:00:00 > 00:00:00:00:00:00, ethertype IPv4 (0x0800), length 66: 127.0.0.1.34651 > 127.0.0.1.34651: UDP, length 24
2004-12-20 04:43:54.345853 00:00:00:00:00:00 > 00:00:00:00:00:00, ethertype IPv4 (0x0800), length 418: 127.0.0.1.34651 > 127.0.0.1.34651: UDP, length 376
2004-12-20 04:43:54.345902 00:00:00:00:00:00 > 00:00:00:00:00:00, ethertype IPv4 (0x0800), length 226: 127.0.0.1.5432 > 127.0.0.1.57830: Flags [P.], seq 1:161, ack 92, win 32767, options [nop,nop,TS val 547839766 ecr 547839765], length 160
2004-12-20 04:43:54.345997 00:00:00:00:00:00 > 00:00:00:00:00:00, ethertype IPv4 (0x0800), length 66: 127.0.0.1.57830 > 127.0.0.1.5432: Flags [.], ack 161, win 32767, options [nop,nop,TS val 547839766 ecr 547839766], length 0
2004-12-20 04:43:54.347782 00:00:00:00:00:00 > 00:00:00:00:00:00, ethertype IPv4 (0x0800), length 74: 127.0.0.1.57831 > 127.0.0.1.5432: Flags [S], seq 2987984283, win 32767, options [mss 16396,sackOK,TS val 547839766 ecr 0,nop,wscale 0], length 0
2004-12-20 04:43:54.347830 00:00:00:00:00:00 > 00:00:00:00:00:00, ethertype IPv4 (0x0800), length 74: 127.0.0.1.5432 > 127.0.0.1.57831: Flags [S.], seq 2983394667, ack 2987984284, win 32767, options [mss 16396,sackOK,TS val 547839766 ecr 547839766,nop,wscale 0], length 0
2004-12-20 04:43:54.347863 00:00:00:00:00:00 > 00:00:00:00:00:00, ethertype IPv4 (0x0800), length 66: 127.0.0.1.57831 > 127.0.0.1.5432: Flags [.], ack 1, win 32767, options [nop,nop,TS val 547839766 ecr 547839766], length 0
2004-12-20 04:43:54.348516 00:00:00:00:00:00 > 00:00:00:00:00:00, ethertype IPv4 (0x0800), length 157: 127.0.0.1.57831 > 127.0.0.1.5432: Flags [P.], seq 1:92, ack 1, win 32767, options [nop,nop,TS val 547839766 ecr 547839766], length 91
2004-12-20 04:43:54.348554 00:00:00:00:00:00 > 00:00:00:00:00:00, ethertype IPv4 (0x0800), length 66: 127.0.0.1.5432 > 127.0.0.1.57831: Flags [.], ack 92, win 32767, options [nop,nop,TS val 547839766 ecr 547839766], length 0
2004-12-20 04:43:54.353446 00:00:00:00:00:00 > 00:00:00:00:00:00, ethertype IPv4 (0x0800), length 66: 127.0.0.1.34651 > 127.0.0.1.34651: UDP, length 24
2004-12-20 04:43:54.353530 00:00:00:00:00:00 > 00:00:00:00:00:00, ethertype IPv4 (0x0800), length 418: 127.0.0.1.34651 > 127.0.0.1.34651: UDP, length 376
2004-12-20 04:43:54.353588 00:00:00:00:00:00 > 00:00:00:00:00:00, ethertype IPv4 (0x0800), length 226: 127.0.0.1.5432 > 127.0.0.1.57831: Flags [P.], seq 1:161, ack 92, win 32767, options [nop,nop,TS val 547839766 ecr 547839766], length 160
2004-12-20 04:43:54.353802 00:00:00:00:00:00 > 00:00:00:00:00:00, ethertype IPv4 (0x0800), length 66: 127.0.0.1.57831 > 127.0.0.1.5432: Flags [.], ack 161, win 32767, options [nop,nop,TS val 547839766 ecr 547839766], length 0
2004-12-20 04:43:54.355096 00:00:00:00:00:00 > 00:00:00:00:00:00, ethertype IPv4 (0x0800), length 136: 127.0.0.1.57831 > 127.0.0.1.5432: Flags [P.], seq 92:162, ack 161, win 32767, options [nop,nop,TS val 547839767 ecr 547839766], length 70
2004-12-20 04:43:54.394616 00:00:00:00:00:00 > 00:00:00:00:00:00, ethertype IPv4 (0x0800), length 66: 127.0.0.1.5432 > 127.0.0.1.57831: Flags [.], ack 162, win 32767, options [nop,nop,TS val 547839771 ecr 547839767], length 0
2004-12-20 04:43:54.427171 00:00:00:00:00:00 > 00:00:00:00:00:00, ethertype IPv4 (0x0800), length 1030: 127.0.0.1.34651 > 127.0.0.1.34651: UDP, length 988
2004-12-20 04:43:54.427215 00:00:00:00:00:00 > 00:00:00:00:00:00, ethertype IPv4 (0x0800), length 1030: 127.0.0.1.34651 > 127.0.0.1.34651: UDP, length 988
2004-12-20 04:43:54.427231 00:00:00:00:00:00 > 00:00:00:00:00:00, ethertype IPv4 (0x0800), length 758: 127.0.0.1.34651 > 127.0.0.1.34651: UDP, length 716
2004-12-20 04:43:54.427277 00:00:00:00:00:00 > 00:00:00:00:00:00, ethertype IPv4 (0x0800), length 103: 127.0.0.1.5432 > 127.0.0.1.57831: Flags [P.], seq 161:198, ack 162, win 32767, options [nop,nop,TS val 547839774 ecr 547839767], length 37
2004-12-20 04:43:54.427954 00:00:00:00:00:00 > 00:00:00:00:00:00, ethertype IPv4 (0x0800), length 136: 127.0.0.1.57831 > 127.0.0.1.5432: Flags [P.], seq 162:232, ack 198, win 32767, options [nop,nop,TS val 547839774 ecr 547839774], length 70
2004-12-20 04:43:54.428051 00:00:00:00:00:00 > 00:00:00:00:00:00, ethertype IPv4 (0x0800), length 66: 127.0.0.1.5432 > 127.0.0.1.57831: Flags [.], ack 232, win 32767, options [nop,nop,TS val 547839774 ecr 547839774], length 0
2004-12-20 04:43:54.434987 00:00:00:00:00:00 > 00:00:00:00:00:00, ethertype IPv4 (0x0800), length 1030: 127.0.0.1.34651 > 127.0.0.1.34651: UDP, length 988
2004-12-20 04:43:54.435029 00:00:00:00:00:00 > 00:00:00:00:00:00, ethertype IPv4 (0x0800), length 690: 127.0.0.1.34651 > 127.0.0.1.34651: UDP, length 648
2004-12-20 04:43:54.435070 00:00:00:00:00:00 > 00:00:00:00:00:00, ethertype IPv4 (0x0800), length 103: 127.0.0.1.5432 > 127.0.0.1.57831: Flags [P.], seq 198:235, ack 232, win 32767, options [nop,nop,TS val 547839775 ecr 547839774], length 37
2004-12-20 04:43:54.435370 00:00:00:00:00:00 > 00:00:00:00:00:00, ethertype IPv4 (0x0800), length 71: 127.0.0.1.57831 > 127.0.0.1.5432: Flags [P.], seq 232:237, ack 235, win 32767, options [nop,nop,TS val 547839775 ecr 547839775], length 5
2004-12-20 04:43:54.435479 00:00:00:00:00:00 > 00:00:00:00:00:00, ethertype IPv4 (0x0800), length 66: 127.0.0.1.57831 > 127.0.0.1.5432: Flags [F.], seq 237, ack 235, win 32767, options [nop,nop,TS val 547839775 ecr 547839775], length 0
2004-12-20 04:43:54.436375 00:00:00:00:00:00 > 00:00:00:00:00:00, ethertype IPv4 (0x0800), length 74: 127.0.0.1.57832 > 127.0.0.1.5432: Flags [S], seq 2982226648, win 32767, options [mss 16396,sackOK,TS val 547839775 ecr 0,nop,wscale 0], length 0
2004-12-20 04:43:54.436416 00:00:00:00:00:00 > 00:00:00:00:00:00, ethertype IPv4 (0x0800), length 74: 127.0.0.1.5432 > 127.0.0.1.57832: Flags [S.], seq 2985801593, ack 2982226649, win 32767, options [mss 16396,sackOK,TS val 547839775 ecr 547839775,nop,wscale 0], length 0
2004-12-20 04:43:54.436448 00:00:00:00:00:00 > 00:00:00:00:00:00, ethertype IPv4 (0x0800), length 66: 127.0.0.1.57832 > 127.0.0.1.5432: Flags [.], ack 1, win 32767, options [nop,nop,TS val 547839775 ecr 547839775], length 0
2004-12-20 04:43:54.437053 00:00:00:00:00:00 > 00:00:00:00:00:00, ethertype IPv4 (0x0800), length 66: 127.0.0.1.5432 > 127.0.0.1.57831: Flags [F.], seq 235, ack 238, win 32767, options [nop,nop,TS val 547839775 ecr 547839775], length 0
2004-12-20 04:43:54.437069 00:00:00:00:00:00 > 00:00:00:00:00:00, ethertype IPv4 (0x0800), length 157: 127.0.0.1.57832 > 127.0.0.1.5432: Flags [P.], seq 1:92, ack 1, win 32767, options [nop,nop,TS val 547839775 ecr 547839775], length 91
2004-12-20 04:43:54.437104 00:00:00:00:00:00 > 00:00:00:00:00:00, ethertype IPv4 (0x0800), length 66: 127.0.0.1.5432 > 127.0.0.1.57832: Flags [.], ack 92, win 32767, options [nop,nop,TS val 547839775 ecr 547839775], length 0
2004-12-20 04:43:54.437115 00:00:00:00:00:00 > 00:00:00:00:00:00, ethertype IPv4 (0x0800), length 66: 127.0.0.1.57831 > 127.0.0.1.5432: Flags [.], ack 236, win 32767, options [nop,nop,TS val 547839775 ecr 547839775], length 0
2004-12-20 04:43:54.437372 00:00:00:00:00:00 > 00:00:00:00:00:00, ethertype IPv4 (0x0800), length 66: 127.0.0.1.34651 > 127.0.0.1.34651: UDP, length 24
2004-12-20 04:43:54.442608 00:00:00:00:00:00 > 00:00:00:00:00:00, ethertype IPv4 (0x0800), length 66: 127.0.0.1.34651 > 127.0.0.1.34651: UDP, length 24
2004-12-20 04:43:54.442692 00:00:00:00:00:00 > 00:00:00:00:00:00, ethertype IPv4 (0x0800), length 418: 127.0.0.1.34651 > 127.0.0.1.34651: UDP, length 376
2004-12-20 04:43:54.442750 00:00:00:00:00:00 > 00:00:00:00:00:00, ethertype IPv4 (0x0800), length 226: 127.0.0.1.5432 > 127.0.0.1.57832: Flags [P.], seq 1:161, ack 92, win 32767, options [nop,nop,TS val 547839775 ecr 547839775], length 160
2004-12-20 04:43:54.442823 00:00:00:00:00:00 > 00:00:00:00:00:00, ethertype IPv4 (0x0800), length 66: 127.0.0.1.57832 > 127.0.0.1.5432: Flags [.], ack 161, win 32767, options [nop,nop,TS val 547839775 ecr 547839775], length 0
2004-12-20 04:43:54.444096 00:00:00:00:00:00 > 00:00:00:00:00:00, ethertype IPv4 (0x0800), length 136: 127.0.0.1.57832 > 127.0.0.1.5432: Flags [P.], seq 92:162, ack 161, win 32767, options [nop,nop,TS val 547839775 ecr 547839775], length 70
2004-12-20 04:43:54.445255 00:00:00:00:00:00 > 00:00:00:00:00:00, ethertype IPv4 (0x0800), length 170: 127.0.0.1.5432 > 127.0.0.1.57832: Flags [P.], seq 161:265, ack 162, win 32767, options [nop,nop,TS val 547839776 ecr 547839775], length 104
2004-12-20 04:43:54.445533 00:00:00:00:00:00 > 00:00:00:00:00:00, ethertype IPv4 (0x0800), length 486: 127.0.0.1.34651 > 127.0.0.1.34651: UDP, length 444
2004-12-20 04:43:54.445684 00:00:00:00:00:00 > 00:00:00:00:00:00, ethertype IPv4 (0x0800), length 72: 127.0.0.1.5432 > 127.0.0.1.57832: Flags [P.], seq 265:271, ack 162, win 32767, options [nop,nop,TS val 547839776 ecr 547839775], length 6
2004-12-20 04:43:54.446367 00:00:00:00:00:00 > 00:00:00:00:00:00, ethertype IPv4 (0x0800), length 164: 127.0.0.1.57832 > 127.0.0.1.5432: Flags [P.], seq 162:260, ack 271, win 32767, options [nop,nop,TS val 547839776 ecr 547839776], length 98
2004-12-20 04:43:54.456823 00:00:00:00:00:00 > 00:00:00:00:00:00, ethertype IPv4 (0x0800), length 1030: 127.0.0.1.34651 > 127.0.0.1.34651: UDP, length 988
2004-12-20 04:43:54.456943 00:00:00:00:00:00 > 00:00:00:00:00:00, ethertype IPv4 (0x0800), length 1030: 127.0.0.1.34651 > 127.0.0.1.34651: UDP, length 988
2004-12-20 04:43:54.457031 00:00:00:00:00:00 > 00:00:00:00:00:00, ethertype IPv4 (0x0800), length 486: 127.0.0.1.34651 > 127.0.0.1.34651: UDP, length 444
2004-12-20 04:43:54.457084 00:00:00:00:00:00 > 00:00:00:00:00:00, ethertype IPv4 (0x0800), length 105: 127.0.0.1.5432 > 127.0.0.1.57832: Flags [P.], seq 271:310, ack 260, win 32767, options [nop,nop,TS val 547839777 ecr 547839776], length 39
2004-12-20 04:43:54.457693 00:00:00:00:00:00 > 00:00:00:00:00:00, ethertype IPv4 (0x0800), length 136: 127.0.0.1.57832 > 127.0.0.1.5432: Flags [P.], seq 260:330, ack 310, win 32767, options [nop,nop,TS val 547839777 ecr 547839777], length 70
2004-12-20 04:43:54.458474 00:00:00:00:00:00 > 00:00:00:00:00:00, ethertype IPv4 (0x0800), length 170: 127.0.0.1.5432 > 127.0.0.1.57832: Flags [P.], seq 310:414, ack 330, win 32767, options [nop,nop,TS val 547839777 ecr 547839777], length 104
2004-12-20 04:43:54.458693 00:00:00:00:00:00 > 00:00:00:00:00:00, ethertype IPv4 (0x0800), length 214: 127.0.0.1.34651 > 127.0.0.1.34651: UDP, length 172
2004-12-20 04:43:54.458806 00:00:00:00:00:00 > 00:00:00:00:00:00, ethertype IPv4 (0x0800), length 72: 127.0.0.1.5432 > 127.0.0.1.57832: Flags [P.], seq 414:420, ack 330, win 32767, options [nop,nop,TS val 547839777 ecr 547839777], length 6
2004-12-20 04:43:54.459329 00:00:00:00:00:00 > 00:00:00:00:00:00, ethertype IPv4 (0x0800), length 167: 127.0.0.1.57832 > 127.0.0.1.5432: Flags [P.], seq 330:431, ack 420, win 32767, options [nop,nop,TS val 547839777 ecr 547839777], length 101
2004-12-20 04:43:54.478330 00:00:00:00:00:00 > 00:00:00:00:00:00, ethertype IPv4 (0x0800), length 1030: 127.0.0.1.34651 > 127.0.0.1.34651: UDP, length 988
2004-12-20 04:43:54.478370 00:00:00:00:00:00 > 00:00:00:00:00:00, ethertype IPv4 (0x0800), length 418: 127.0.0.1.34651 > 127.0.0.1.34651: UDP, length 376
2004-12-20 04:43:54.478409 00:00:00:00:00:00 > 00:00:00:00:00:00, ethertype IPv4 (0x0800), length 105: 127.0.0.1.5432 > 127.0.0.1.57832: Flags [P.], seq 420:459, ack 431, win 32767, options [nop,nop,TS val 547839779 ecr 547839777], length 39
2004-12-20 04:43:54.478838 00:00:00:00:00:00 > 00:00:00:00:00:00, ethertype IPv4 (0x0800), length 71: 127.0.0.1.57832 > 127.0.0.1.5432: Flags [P.], seq 431:436, ack 459, win 32767, options [nop,nop,TS val 547839779 ecr 547839779], length 5
2004-12-20 04:43:54.478948 00:00:00:00:00:00 > 00:00:00:00:00:00, ethertype IPv4 (0x0800), length 66: 127.0.0.1.57832 > 127.0.0.1.5432: Flags [F.], seq 436, ack 459, win 32767, options [nop,nop,TS val 547839779 ecr 547839779], length 0
2004-12-20 04:43:54.479915 00:00:00:00:00:00 > 00:00:00:00:00:00, ethertype IPv4 (0x0800), length 74: 127.0.0.1.57833 > 127.0.0.1.5432: Flags [S], seq 2978348777, win 32767, options [mss 16396,sackOK,TS val 547839779 ecr 0,nop,wscale 0], length 0
2004-12-20 04:43:54.479957 00:00:00:00:00:00 > 00:00:00:00:00:00, ethertype IPv4 (0x0800), length 74: 127.0.0.1.5432 > 127.0.0.1.57833: Flags [S.], seq 2988217178, ack 2978348778, win 32767, options [mss 16396,sackOK,TS val 547839779 ecr 547839779,nop,wscale 0], length 0
2004-12-20 04:43:54.479985 00:00:00:00:00:00 > 00:00:00:00:00:00, ethertype IPv4 (0x0800), length 66: 127.0.0.1.57833 > 127.0.0.1.5432: Flags [.], ack 1, win 32767, options [nop,nop,TS val 547839779 ecr 547839779], length 0
2004-12-20 04:43:54.480589 00:00:00:00:00:00 > 00:00:00:00:00:00, ethertype IPv4 (0x0800), length 66: 127.0.0.1.5432 > 127.0.0.1.57832: Flags [F.], seq 459, ack 437, win 32767, options [nop,nop,TS val 547839779 ecr 547839779], length 0
2004-12-20 04:43:54.480608 00:00:00:00:00:00 > 00:00:00:00:00:00, ethertype IPv4 (0x0800), length 157: 127.0.0.1.57833 > 127.0.0.1.5432: Flags [P.], seq 1:92, ack 1, win 32767, options [nop,nop,TS val 547839779 ecr 547839779], length 91
2004-12-20 04:43:54.480649 00:00:00:00:00:00 > 00:00:00:00:00:00, ethertype IPv4 (0x0800), length 66: 127.0.0.1.5432 > 127.0.0.1.57833: Flags [.], ack 92, win 32767, options [nop,nop,TS val 547839779 ecr 547839779], length 0
2004-12-20 04:43:54.480653 00:00:00:00:00:00 > 00:00:00:00:00:00, ethertype IPv4 (0x0800), length 66: 127.0.0.1.57832 > 127.0.0.1.5432: Flags [.], ack 460, win 32767, options [nop,nop,TS val 547839779 ecr 547839779], length 0
2004-12-20 04:43:54.480921 00:00:00:00:00:00 > 00:00:00:00:00:00, ethertype IPv4 (0x0800), length 66: 127.0.0.1.34651 > 127.0.0.1.34651: UDP, length 24
2004-12-20 04:43:54.486161 00:00:00:00:00:00 > 00:00:00:00:00:00, ethertype IPv4 (0x0800), length 66: 127.0.0.1.34651 > 127.0.0.1.34651: UDP, length 24
2004-12-20 04:43:54.486245 00:00:00:00:00:00 > 00:00:00:00:00:00, ethertype IPv4 (0x0800), length 418: 127.0.0.1.34651 > 127.0.0.1.34651: UDP, length 376
2004-12-20 04:43:54.486304 00:00:00:00:00:00 > 00:00:00:00:00:00, ethertype IPv4 (0x0800), length 226: 127.0.0.1.5432 > 127.0.0.1.57833: Flags [P.], seq 1:161, ack 92, win 32767, options [nop,nop,TS val 547839780 ecr 547839779], length 160
2004-12-20 04:43:54.486476 00:00:00:00:00:00 > 00:00:00:00:00:00, ethertype IPv4 (0x0800), length 66: 127.0.0.1.57833 > 127.0.0.1.5432: Flags [.], ack 161, win 32767, options [nop,nop,TS val 547839780 ecr 547839780], length 0
2004-12-20 04:43:54.490595 00:00:00:00:00:00 > 00:00:00:00:00:00, ethertype IPv4 (0x0800), length 74: 127.0.0.1.57834 > 127.0.0.1.5432: Flags [S], seq 2986925188, win 32767, options [mss 16396,sackOK,TS val 547839780 ecr 0,nop,wscale 0], length 0
2004-12-20 04:43:54.490644 00:00:00:00:00:00 > 00:00:00:00:00:00, ethertype IPv4 (0x0800), length 74: 127.0.0.1.5432 > 127.0.0.1.57834: Flags [S.], seq 2981047387, ack 2986925189, win 32767, options [mss 16396,sackOK,TS val 547839780 ecr 547839780,nop,wscale 0], length 0
2004-12-20 04:43:54.490677 00:00:00:00:00:00 > 00:00:00:00:00:00, ethertype IPv4 (0x0800), length 66: 127.0.0.1.57834 > 127.0.0.1.5432: Flags [.], ack 1, win 32767, options [nop,nop,TS val 547839780 ecr 547839780], length 0
2004-12-20 04:43:54.491338 00:00:00:00:00:00 > 00:00:00:00:00:00, ethertype IPv4 (0x0800), length 157: 127.0.0.1.57834 > 127.0.0.1.5432: Flags [P.], seq 1:92, ack 1, win 32767, options [nop,nop,TS val 547839780 ecr 547839780], length 91
2004-12-20 04:43:54.491380 00:00:00:00:00:00 > 00:00:00:00:00:00, ethertype IPv4 (0x0800), length 66: 127.0.0.1.5432 > 127.0.0.1.57834: Flags [.], ack 92, win 32767, options [nop,nop,TS val 547839780 ecr 547839780], length 0
2004-12-20 04:43:54.496373 00:00:00:00:00:00 > 00:00:00:00:00:00, ethertype IPv4 (0x0800), length 66: 127.0.0.1.34651 > 127.0.0.1.34651: UDP, length 24
2004-12-20 04:43:54.496594 00:00:00:00:00:00 > 00:00:00:00:00:00, ethertype IPv4 (0x0800), length 418: 127.0.0.1.34651 > 127.0.0.1.34651: UDP, length 376
2004-12-20 04:43:54.496656 00:00:00:00:00:00 > 00:00:00:00:00:00, ethertype IPv4 (0x0800), length 226: 127.0.0.1.5432 > 127.0.0.1.57834: Flags [P.], seq 1:161, ack 92, win 32767, options [nop,nop,TS val 547839781 ecr 547839780], length 160
2004-12-20 04:43:54.496774 00:00:00:00:00:00 > 00:00:00:00:00:00, ethertype IPv4 (0x0800), length 66: 127.0.0.1.57834 > 127.0.0.1.5432: Flags [.], ack 161, win 32767, options [nop,nop,TS val 547839781 ecr 547839781], length 0
2004-12-20 04:43:54.500736 00:00:00:00:00:00 > 00:00:00:00:00:00, ethertype IPv4 (0x0800), length 136: 127.0.0.1.57834 > 127.0.0.1.5432: Flags [P.], seq 92:162, ack 161, win 32767, options [nop,nop,TS val 547839781 ecr 547839781], length 70
2004-12-20 04:43:54.507420 00:00:00:00:00:00 > 00:00:00:00:00:00, ethertype IPv4 (0x0800), length 1030: 127.0.0.1.34651 > 127.0.0.1.34651: UDP, length 988
2004-12-20 04:43:54.507547 00:00:00:00:00:00 > 00:00:00:00:00:00, ethertype IPv4 (0x0800), length 1030: 127.0.0.1.34651 > 127.0.0.1.34651: UDP, length 988
2004-12-20 04:43:54.507650 00:00:00:00:00:00 > 00:00:00:00:00:00, ethertype IPv4 (0x0800), length 758: 127.0.0.1.34651 > 127.0.0.1.34651: UDP, length 716
2004-12-20 04:43:54.507719 00:00:00:00:00:00 > 00:00:00:00:00:00, ethertype IPv4 (0x0800), length 103: 127.0.0.1.5432 > 127.0.0.1.57834: Flags [P.], seq 161:198, ack 162, win 32767, options [nop,nop,TS val 547839782 ecr 547839781], length 37
2004-12-20 04:43:54.508374 00:00:00:00:00:00 > 00:00:00:00:00:00, ethertype IPv4 (0x0800), length 136: 127.0.0.1.57834 > 127.0.0.1.5432: Flags [P.], seq 162:232, ack 198, win 32767, options [nop,nop,TS val 547839782 ecr 547839782], length 70
2004-12-20 04:43:54.513607 00:00:00:00:00:00 > 00:00:00:00:00:00, ethertype IPv4 (0x0800), length 1030: 127.0.0.1.34651 > 127.0.0.1.34651: UDP, length 988
2004-12-20 04:43:54.513772 00:00:00:00:00:00 > 00:00:00:00:00:00, ethertype IPv4 (0x0800), length 690: 127.0.0.1.34651 > 127.0.0.1.34651: UDP, length 648
2004-12-20 04:43:54.513841 00:00:00:00:00:00 > 00:00:00:00:00:00, ethertype IPv4 (0x0800), length 103: 127.0.0.1.5432 > 127.0.0.1.57834: Flags [P.], seq 198:235, ack 232, win 32767, options [nop,nop,TS val 547839782 ecr 547839782], length 37
2004-12-20 04:43:54.514189 00:00:00:00:00:00 > 00:00:00:00:00:00, ethertype IPv4 (0x0800), length 71: 127.0.0.1.57834 > 127.0.0.1.5432: Flags [P.], seq 232:237, ack 235, win 32767, options [nop,nop,TS val 547839782 ecr 547839782], length 5
2004-12-20 04:43:54.514302 00:00:00:00:00:00 > 00:00:00:00:00:00, ethertype IPv4 (0x0800), length 66: 127.0.0.1.57834 > 127.0.0.1.5432: Flags [F.], seq 237, ack 235, win 32767, options [nop,nop,TS val 547839782 ecr 547839782], length 0
2004-12-20 04:43:54.515195 00:00:00:00:00:00 > 00:00:00:00:00:00, ethertype IPv4 (0x0800), length 74: 127.0.0.1.57835 > 127.0.0.1.5432: Flags [S], seq 2987922885, win 32767, options [mss 16396,sackOK,TS val 547839783 ecr 0,nop,wscale 0], length 0
2004-12-20 04:43:54.515245 00:00:00:00:00:00 > 00:00:00:00:00:00, ethertype IPv4 (0x0800), length 74: 127.0.0.1.5432 > 127.0.0.1.57835: Flags [S.], seq 2989749603, ack 2987922886, win 32767, options [mss 16396,sackOK,TS val 547839783 ecr 547839783,nop,wscale 0], length 0
2004-12-20 04:43:54.515275 00:00:00:00:00:00 > 00:00:00:00:00:00, ethertype IPv4 (0x0800), length 66: 127.0.0.1.57835 > 127.0.0.1.5432: Flags [.], ack 1, win 32767, options [nop,nop,TS val 547839783 ecr 547839783], length 0
2004-12-20 04:43:54.515884 00:00:00:00:00:00 > 00:00:00:00:00:00, ethertype IPv4 (0x0800), length 157: 127.0.0.1.57835 > 127.0.0.1.5432: Flags [P.], seq 1:92, ack 1, win 32767, options [nop,nop,TS val 547839783 ecr 547839783], length 91
2004-12-20 04:43:54.515910 00:00:00:00:00:00 > 00:00:00:00:00:00, ethertype IPv4 (0x0800), length 66: 127.0.0.1.5432 > 127.0.0.1.57835: Flags [.], ack 92, win 32767, options [nop,nop,TS val 547839783 ecr 547839783], length 0
2004-12-20 04:43:54.515995 00:00:00:00:00:00 > 00:00:00:00:00:00, ethertype IPv4 (0x0800), length 66: 127.0.0.1.5432 > 127.0.0.1.57834: Flags [F.], seq 235, ack 238, win 32767, options [nop,nop,TS val 547839783 ecr 547839782], length 0
2004-12-20 04:43:54.516062 00:00:00:00:00:00 > 00:00:00:00:00:00, ethertype IPv4 (0x0800), length 66: 127.0.0.1.57834 > 127.0.0.1.5432: Flags [.], ack 236, win 32767, options [nop,nop,TS val 547839783 ecr 547839783], length 0
2004-12-20 04:43:54.516278 00:00:00:00:00:00 > 00:00:00:00:00:00, ethertype IPv4 (0x0800), length 66: 127.0.0.1.34651 > 127.0.0.1.34651: UDP, length 24
2004-12-20 04:43:54.521421 00:00:00:00:00:00 > 00:00:00:00:00:00, ethertype IPv4 (0x0800), length 66: 127.0.0.1.34651 > 127.0.0.1.34651: UDP, length 24
2004-12-20 04:43:54.521506 00:00:00:00:00:00 > 00:00:00:00:00:00, ethertype IPv4 (0x0800), length 418: 127.0.0.1.34651 > 127.0.0.1.34651: UDP, length 376
2004-12-20 04:43:54.521564 00:00:00:00:00:00 > 00:00:00:00:00:00, ethertype IPv4 (0x0800), length 226: 127.0.0.1.5432 > 127.0.0.1.57835: Flags [P.], seq 1:161, ack 92, win 32767, options [nop,nop,TS val 547839783 ecr 547839783], length 160
2004-12-20 04:43:54.521747 00:00:00:00:00:00 > 00:00:00:00:00:00, ethertype IPv4 (0x0800), length 66: 127.0.0.1.57835 > 127.0.0.1.5432: Flags [.], ack 161, win 32767, options [nop,nop,TS val 547839783 ecr 547839783], length 0
2004-12-20 04:43:54.522952 00:00:00:00:00:00 > 00:00:00:00:00:00, ethertype IPv4 (0x0800), length 136: 127.0.0.1.57835 > 127.0.0.1.5432: Flags [P.], seq 92:162, ack 161, win 32767, options [nop,nop,TS val 547839783 ecr 547839783], length 70
2004-12-20 04:43:54.524009 00:00:00:00:00:00 > 00:00:00:00:00:00, ethertype IPv4 (0x0800), length 170: 127.0.0.1.5432 > 127.0.0.1.57835: Flags [P.], seq 161:265, ack 162, win 32767, options [nop,nop,TS val 547839783 ecr 547839783], length 104
2004-12-20 04:43:54.524266 00:00:00:00:00:00 > 00:00:00:00:00:00, ethertype IPv4 (0x0800), length 486: 127.0.0.1.34651 > 127.0.0.1.34651: UDP, length 444
2004-12-20 04:43:54.524420 00:00:00:00:00:00 > 00:00:00:00:00:00, ethertype IPv4 (0x0800), length 72: 127.0.0.1.5432 > 127.0.0.1.57835: Flags [P.], seq 265:271, ack 162, win 32767, options [nop,nop,TS val 547839783 ecr 547839783], length 6
2004-12-20 04:43:54.525127 00:00:00:00:00:00 > 00:00:00:00:00:00, ethertype IPv4 (0x0800), length 164: 127.0.0.1.57835 > 127.0.0.1.5432: Flags [P.], seq 162:260, ack 271, win 32767, options [nop,nop,TS val 547839784 ecr 547839783], length 98
2004-12-20 04:43:54.535766 00:00:00:00:00:00 > 00:00:00:00:00:00, ethertype IPv4 (0x0800), length 1030: 127.0.0.1.34651 > 127.0.0.1.34651: UDP, length 988
2004-12-20 04:43:54.535883 00:00:00:00:00:00 > 00:00:00:00:00:00, ethertype IPv4 (0x0800), length 1030: 127.0.0.1.34651 > 127.0.0.1.34651: UDP, length 988
2004-12-20 04:43:54.535971 00:00:00:00:00:00 > 00:00:00:00:00:00, ethertype IPv4 (0x0800), length 486: 127.0.0.1.34651 > 127.0.0.1.34651: UDP, length 444
