2025-06-14 00:33:55.686551 IP 0.0.0.0.68 > 255.255.255.255.67: BOOTP/DHCP, Request from 24:77:03:ac:97:df, length 302
2025-06-14 00:33:55.687766 IP 10.6.13.3.67 > 255.255.255.255.68: BOOTP/DHCP, Reply, length 300
2025-06-14 00:33:55.689030 IP 0.0.0.0.68 > 255.255.255.255.67: BOOTP/DHCP, Request from 24:77:03:ac:97:df, length 345
2025-06-14 00:33:55.690049 IP 10.6.13.3.67 > 255.255.255.255.68: BOOTP/DHCP, Reply, length 300
2025-06-14 00:33:55.712625 ARP, Request who-has 10.6.13.3 tell 10.6.13.133, length 46
2025-06-14 00:33:55.712626 ARP, Reply 10.6.13.3 is-at 00:26:b9:71:ad:36, length 46
2025-06-14 00:33:55.712627 IP 10.6.13.133.61943 > 10.6.13.3.53: 11151+ A? wpad.massfriction.com. (39)
2025-06-14 00:33:55.712981 IP 10.6.13.3.53 > 10.6.13.133.61943: 11151 NXDomain* 0/1/0 (118)
2025-06-14 00:33:55.714176 IP 10.6.13.133.52241 > 10.6.13.3.53: 22249+ SOA? DESKTOP-5AVE44C.massfriction.com. (50)
2025-06-14 00:33:55.714359 IP 10.6.13.133.53493 > 10.6.13.3.53: 18701+ A? wpad.massfriction.com. (39)
2025-06-14 00:33:55.714360 IP 10.6.13.3.53 > 10.6.13.133.52241: 22249* 0/1/1 (129)
2025-06-14 00:33:55.714361 IP 10.6.13.133.54131 > 224.0.0.252.5355: UDP, length 33
2025-06-14 00:33:55.714570 IP 10.6.13.3.53 > 10.6.13.133.53493: 18701 NXDomain* 0/1/0 (118)
2025-06-14 00:33:55.715541 IP 10.6.13.133.52241 > 10.6.13.3.53: 21583 update [1a] [3n] SOA? massfriction.com. (118)
2025-06-14 00:33:55.717558 IP 10.6.13.3.53 > 10.6.13.133.52241: 21583 update- 1/3/0 (Class 254) CNAME DESKTOP-5AVE44C.massfriction.com. (118)
2025-06-14 00:33:55.734271 IP 10.6.13.133.53493 > 10.6.13.3.53: 28589+ SRV? _ldap._tcp.Default-First-Site-Name._sites.dc._msdcs.massfriction.com. (86)
2025-06-14 00:33:55.734567 IP 10.6.13.3.53 > 10.6.13.133.53493: 28589* 1/0/1 SRV win-dql4wfwjxq4.massfriction.com.:389 0 100 (154)
2025-06-14 00:33:55.734991 IP 10.6.13.133.52241 > 10.6.13.3.53: 34183+ A? win-dql4wfwjxq4.massfriction.com. (50)
2025-06-14 00:33:55.735214 IP 10.6.13.3.53 > 10.6.13.133.52241: 34183* 1/0/0 A 10.6.13.3 (66)
2025-06-14 00:33:55.735904 IP 10.6.13.133.53497 > 10.6.13.3.389: UDP, length 227
2025-06-14 00:33:55.735906 IP 10.6.13.133.53497 > 10.6.13.3.389: UDP, length 227
2025-06-14 00:33:55.736155 IP 10.6.13.3.389 > 10.6.13.133.53497: UDP, length 202
2025-06-14 00:33:55.736156 IP 10.6.13.3.389 > 10.6.13.133.53497: UDP, length 202
2025-06-14 00:33:55.780639 IP 10.6.13.133.137 > 10.6.13.255.137: UDP, length 68
2025-06-14 00:33:55.780641 IP 10.6.13.133.137 > 10.6.13.255.137: UDP, length 68
2025-06-14 00:33:55.780642 IP 10.6.13.133.137 > 10.6.13.255.137: UDP, length 68
2025-06-14 00:33:55.795110 ARP, Request who-has 10.6.13.133 tell 0.0.0.0, length 46
2025-06-14 00:33:55.843517 IP 10.6.13.133.52427 > 10.6.13.3.389: Flags [S], seq 3563809655, win 65535, options [mss 1460,nop,wscale 8,nop,nop,sackOK], length 0
2025-06-14 00:33:55.843520 IP 10.6.13.3.389 > 10.6.13.133.52427: Flags [S.], seq 2343277333, ack 3563809656, win 65535, options [mss 1460,nop,wscale 8,nop,nop,sackOK], length 0
2025-06-14 00:33:55.843854 IP 10.6.13.133.52427 > 10.6.13.3.389: Flags [.], ack 1, win 255, length 0
2025-06-14 00:33:55.844098 IP 10.6.13.133.52427 > 10.6.13.3.389: Flags [P.], seq 1:351, ack 1, win 255, length 350
2025-06-14 00:33:55.844998 IP 10.6.13.3.389 > 10.6.13.133.52427: Flags [.], seq 1:1461, ack 351, win 4099, length 1460
2025-06-14 00:33:55.845000 IP 10.6.13.3.389 > 10.6.13.133.52427: Flags [P.], seq 1461:2837, ack 351, win 4099, length 1376
2025-06-14 00:33:55.845170 IP 10.6.13.133.52427 > 10.6.13.3.389: Flags [.], ack 2837, win 255, length 0
2025-06-14 00:33:55.846395 IP 10.6.13.133.52428 > 10.6.13.3.88: Flags [S], seq 1408468731, win 65535, options [mss 1460,nop,wscale 8,nop,nop,sackOK], length 0
2025-06-14 00:33:55.846397 IP 10.6.13.3.88 > 10.6.13.133.52428: Flags [S.], seq 1815632260, ack 1408468732, win 65535, options [mss 1460,nop,wscale 8,nop,nop,sackOK], length 0
2025-06-14 00:33:55.846619 IP 10.6.13.133.52428 > 10.6.13.3.88: Flags [.], ack 1, win 255, length 0
2025-06-14 00:33:55.847018 IP 10.6.13.133.52428 > 10.6.13.3.88: Flags [.], seq 1:1461, ack 1, win 255, length 1460
2025-06-14 00:33:55.847020 IP 10.6.13.133.52428 > 10.6.13.3.88: Flags [P.], seq 1461:1910, ack 1, win 255, length 449
2025-06-14 00:33:55.847021 IP 10.6.13.3.88 > 10.6.13.133.52428: Flags [.], ack 1910, win 4100, length 0
2025-06-14 00:33:55.850245 IP 10.6.13.3.88 > 10.6.13.133.52428: Flags [.], seq 1:1461, ack 1910, win 4100, length 1460
2025-06-14 00:33:55.850248 IP 10.6.13.3.88 > 10.6.13.133.52428: Flags [P.], seq 1461:1878, ack 1910, win 4100, length 417
2025-06-14 00:33:55.850311 IP 10.6.13.133.52428 > 10.6.13.3.88: Flags [.], ack 1878, win 255, length 0
2025-06-14 00:33:55.850345 IP 10.6.13.133.52428 > 10.6.13.3.88: Flags [F.], seq 1910, ack 1878, win 255, length 0
2025-06-14 00:33:55.850560 IP 10.6.13.3.88 > 10.6.13.133.52428: Flags [.], ack 1911, win 4100, length 0
2025-06-14 00:33:55.850561 IP 10.6.13.3.88 > 10.6.13.133.52428: Flags [R.], seq 1878, ack 1911, win 0, length 0
2025-06-14 00:33:55.851643 IP 10.6.13.133.52427 > 10.6.13.3.389: Flags [.], seq 351:1811, ack 2837, win 255, length 1460
2025-06-14 00:33:55.851645 IP 10.6.13.133.52427 > 10.6.13.3.389: Flags [P.], seq 1811:2489, ack 2837, win 255, length 678
2025-06-14 00:33:55.851647 IP 10.6.13.3.389 > 10.6.13.133.52427: Flags [.], ack 2489, win 4100, length 0
2025-06-14 00:33:55.853280 IP 10.6.13.3.389 > 10.6.13.133.52427: Flags [P.], seq 2837:3048, ack 2489, win 4100, length 211
2025-06-14 00:33:55.853996 IP 10.6.13.133.52427 > 10.6.13.3.389: Flags [P.], seq 2489:2564, ack 3048, win 255, length 75
2025-06-14 00:33:55.854153 IP 10.6.13.3.389 > 10.6.13.133.52427: Flags [R.], seq 3048, ack 2564, win 0, length 0
2025-06-14 00:33:55.854185 IP 10.6.13.133.52427 > 10.6.13.3.389: Flags [F.], seq 2564, ack 3048, win 255, length 0
2025-06-14 00:33:55.854186 IP 10.6.13.3.389 > 10.6.13.133.52427: Flags [R], seq 2343280381, win 0, length 0
2025-06-14 00:33:56.130896 IP 10.6.13.133.54131 > 224.0.0.252.5355: UDP, length 33
2025-06-14 00:33:56.299802 ARP, Request who-has 169.254.48.3 tell 0.0.0.0, length 46
2025-06-14 00:33:56.549289 IP 10.6.13.133.137 > 10.6.13.255.137: UDP, length 68
2025-06-14 00:33:56.549291 IP 10.6.13.133.137 > 10.6.13.255.137: UDP, length 68
2025-06-14 00:33:56.549293 IP 10.6.13.133.137 > 10.6.13.255.137: UDP, length 68
2025-06-14 00:33:56.800291 ARP, Request who-has 10.6.13.133 tell 0.0.0.0, length 46
2025-06-14 00:33:57.300297 ARP, Request who-has 169.254.48.3 tell 0.0.0.0, length 46
2025-06-14 00:33:57.300299 IP 10.6.13.133.137 > 10.6.13.255.137: UDP, length 68
2025-06-14 00:33:57.300301 IP 10.6.13.133.137 > 10.6.13.255.137: UDP, length 68
2025-06-14 00:33:57.300302 IP 10.6.13.133.137 > 10.6.13.255.137: UDP, length 68
2025-06-14 00:33:57.795754 ARP, Request who-has 10.6.13.133 tell 0.0.0.0, length 46
2025-06-14 00:33:58.051021 IP 10.6.13.133.137 > 10.6.13.255.137: UDP, length 68
2025-06-14 00:33:58.051023 IP 10.6.13.133.137 > 10.6.13.255.137: UDP, length 68
2025-06-14 00:33:58.051025 IP 10.6.13.133.137 > 10.6.13.255.137: UDP, length 68
2025-06-14 00:33:58.051175 IP 10.6.13.133.53495 > 239.255.255.250.1900: UDP, length 137
2025-06-14 00:33:58.306175 ARP, Request who-has 169.254.48.3 tell 0.0.0.0, length 46
2025-06-14 00:33:58.798773 ARP, Request who-has 10.6.13.133 tell 10.6.13.133, length 46
2025-06-14 00:33:58.847524 IP 10.6.13.133.137 > 10.6.13.255.137: UDP, length 68
2025-06-14 00:33:59.017720 IP 10.6.13.133.53495 > 239.255.255.250.1900: UDP, length 137
2025-06-14 00:33:59.050782 IP 10.6.13.133.53495 > 239.255.255.250.1900: UDP, length 137
2025-06-14 00:33:59.598838 IP 10.6.13.133.137 > 10.6.13.255.137: UDP, length 68
2025-06-14 00:33:59.870499 IP 10.6.13.133.65196 > 10.6.13.3.53: 14652+ A? kv601.prod.do.dsp.mp.microsoft.com. (52)
2025-06-14 00:33:59.912991 IP 10.6.13.3.53 > 10.6.13.133.65196: 14652 3/0/0 CNAME kv601.prod.do.dsp.mp.microsoft.com.edgekey.net., CNAME e12358.d.akamaiedge.net., A 173.222.52.33 (162)
2025-06-14 00:33:59.913941 ARP, Request who-has 10.6.13.1 tell 10.6.13.133, length 46
2025-06-14 00:33:59.913942 ARP, Reply 10.6.13.1 is-at 00:02:ba:54:95:22, length 46
2025-06-14 00:33:59.914014 IP 10.6.13.133.52429 > 173.222.52.33.443: Flags [S], seq 3903582254, win 65535, options [mss 1460,nop,wscale 8,nop,nop,sackOK], length 0
2025-06-14 00:33:59.954220 IP 173.222.52.33.443 > 10.6.13.133.52429: Flags [S.], seq 1090476731, ack 3903582255, win 64240, options [mss 1396,nop,nop,sackOK,nop,wscale 7], length 0
2025-06-14 00:33:59.954563 IP 10.6.13.133.52429 > 173.222.52.33.443: Flags [.], ack 1, win 255, length 0
2025-06-14 00:33:59.955570 IP 10.6.13.133.52429 > 173.222.52.33.443: Flags [P.], seq 1:218, ack 1, win 255, length 217
2025-06-14 00:33:59.994822 IP 10.6.13.133.65197 > 10.6.13.3.389: UDP, length 227
2025-06-14 00:33:59.995041 IP 10.6.13.3.389 > 10.6.13.133.65197: UDP, length 202
2025-06-14 00:34:00.003370 IP 173.222.52.33.443 > 10.6.13.133.52429: Flags [.], ack 218, win 501, length 0
2025-06-14 00:34:00.003371 IP 173.222.52.33.443 > 10.6.13.133.52429: Flags [.], seq 1:1377, ack 218, win 501, length 1376
2025-06-14 00:34:00.003558 IP 173.222.52.33.443 > 10.6.13.133.52429: Flags [P.], seq 1377:2753, ack 218, win 501, length 1376
2025-06-14 00:34:00.003559 IP 173.222.52.33.443 > 10.6.13.133.52429: Flags [P.], seq 2753:4097, ack 218, win 501, length 1344
2025-06-14 00:34:00.003560 IP 10.6.13.133.52429 > 173.222.52.33.443: Flags [.], ack 2753, win 255, length 0
2025-06-14 00:34:00.014420 IP 173.222.52.33.443 > 10.6.13.133.52429: Flags [.], seq 4097:5473, ack 218, win 501, length 1376
2025-06-14 00:34:00.014592 IP 10.6.13.133.52429 > 173.222.52.33.443: Flags [.], ack 5473, win 255, length 0
2025-06-14 00:34:00.031516 IP 173.222.52.33.443 > 10.6.13.133.52429: Flags [P.], seq 5473:6002, ack 218, win 501, length 529
2025-06-14 00:34:00.033288 IP 10.6.13.133.52429 > 173.222.52.33.443: Flags [P.], seq 218:344, ack 6002, win 253, length 126
2025-06-14 00:34:00.061409 IP 173.222.52.33.443 > 10.6.13.133.52429: Flags [P.], seq 6002:6292, ack 344, win 501, length 290
2025-06-14 00:34:00.062281 IP 10.6.13.133.52429 > 173.222.52.33.443: Flags [P.], seq 344:678, ack 6292, win 252, length 334
2025-06-14 00:34:00.102980 IP 173.222.52.33.443 > 10.6.13.133.52429: Flags [.], seq 6292:7668, ack 678, win 501, length 1376
2025-06-14 00:34:00.102982 IP 173.222.52.33.443 > 10.6.13.133.52429: Flags [P.], seq 7668:7670, ack 678, win 501, length 2
2025-06-14 00:34:00.102983 IP 10.6.13.133.52429 > 173.222.52.33.443: Flags [.], ack 7670, win 255, length 0
2025-06-14 00:34:00.109090 IP 10.6.13.133.65196 > 10.6.13.3.53: 21034+ A? geo.prod.do.dsp.mp.microsoft.com. (50)
2025-06-14 00:34:00.152757 IP 10.6.13.3.53 > 10.6.13.133.65196: 21034 3/0/0 CNAME geo.prod.do.dsp.trafficmanager.net., CNAME array818.prod.do.dsp.mp.microsoft.com., A 52.156.123.84 (137)
2025-06-14 00:34:00.153463 IP 10.6.13.133.52430 > 52.156.123.84.443: Flags [S], seq 1531707084, win 65535, options [mss 1460,nop,wscale 8,nop,nop,sackOK], length 0
2025-06-14 00:34:00.233846 IP 52.156.123.84.443 > 10.6.13.133.52430: Flags [S.], seq 2269591028, ack 1531707085, win 65535, options [mss 1396,nop,wscale 8,nop,nop,sackOK], length 0
2025-06-14 00:34:00.234081 IP 10.6.13.133.52430 > 52.156.123.84.443: Flags [.], ack 1, win 255, length 0
2025-06-14 00:34:00.235008 IP 10.6.13.133.52430 > 52.156.123.84.443: Flags [P.], seq 1:216, ack 1, win 255, length 215
2025-06-14 00:34:00.321961 IP 52.156.123.84.443 > 10.6.13.133.52430: Flags [.], seq 1:1377, ack 216, win 2052, length 1376
2025-06-14 00:34:00.323861 IP 52.156.123.84.443 > 10.6.13.133.52430: Flags [P.], seq 1377:2433, ack 216, win 2052, length 1056
2025-06-14 00:34:00.323863 IP 10.6.13.133.52430 > 52.156.123.84.443: Flags [.], ack 2433, win 255, length 0
2025-06-14 00:34:00.325704 IP 10.6.13.133.52430 > 52.156.123.84.443: Flags [P.], seq 216:374, ack 2433, win 255, length 158
2025-06-14 00:34:00.362625 IP 10.6.13.133.137 > 10.6.13.255.137: UDP, length 68
2025-06-14 00:34:00.380409 IP 10.6.13.133.61884 > 10.6.13.3.53: 58078+ A? wpad.massfriction.com. (39)
2025-06-14 00:34:00.380577 IP 10.6.13.3.53 > 10.6.13.133.61884: 58078 NXDomain* 0/1/0 (118)
2025-06-14 00:34:00.380578 IP 10.6.13.133.65196 > 10.6.13.3.53: 49299+ A? wpad.massfriction.com. (39)
2025-06-14 00:34:00.380782 IP 10.6.13.3.53 > 10.6.13.133.65196: 49299 NXDomain* 0/1/0 (118)
2025-06-14 00:34:00.403310 IP 10.6.13.133.61884 > 10.6.13.3.53: 20066+ A? www.msftconnecttest.com. (41)
2025-06-14 00:34:00.413803 IP 52.156.123.84.443 > 10.6.13.133.52430: Flags [P.], seq 2433:2484, ack 374, win 2051, length 51
2025-06-14 00:34:00.413804 IP 52.156.123.84.443 > 10.6.13.133.52430: Flags [P.], seq 2484:2553, ack 374, win 2051, length 69
2025-06-14 00:34:00.413805 IP 10.6.13.133.52430 > 52.156.123.84.443: Flags [.], ack 2553, win 255, length 0
2025-06-14 00:34:00.414623 IP 10.6.13.133.52430 > 52.156.123.84.443: Flags [P.], seq 374:461, ack 2553, win 255, length 87
2025-06-14 00:34:00.414624 IP 10.6.13.133.52430 > 52.156.123.84.443: Flags [P.], seq 461:635, ack 2553, win 255, length 174
2025-06-14 00:34:00.414625 IP 10.6.13.133.52430 > 52.156.123.84.443: Flags [P.], seq 635:673, ack 2553, win 255, length 38
2025-06-14 00:34:00.442333 IP 10.6.13.3.53 > 10.6.13.133.61884: 20066 5/0/0 CNAME ncsi-geo.trafficmanager.net., CNAME www.msftncsi.com.edgesuite.net., CNAME a1961.g2.akamai.net., A 23.192.223.206, A 23.192.223.200 (185)
2025-06-14 00:34:00.442738 IP 10.6.13.133.52431 > 23.192.223.206.80: Flags [S], seq 3300728159, win 65535, options [mss 1460,nop,wscale 8,nop,nop,sackOK], length 0
2025-06-14 00:34:00.479695 IP 23.192.223.206.80 > 10.6.13.133.52431: Flags [S.], seq 2316733685, ack 3300728160, win 64240, options [mss 1396,nop,nop,sackOK,nop,wscale 7], length 0
2025-06-14 00:34:00.479703 IP 10.6.13.133.52431 > 23.192.223.206.80: Flags [.], ack 1, win 255, length 0
2025-06-14 00:34:00.479901 IP 10.6.13.133.52431 > 23.192.223.206.80: Flags [P.], seq 1:112, ack 1, win 255, length 111: HTTP: GET /connecttest.txt HTTP/1.1
2025-06-14 00:34:00.494325 IP 52.156.123.84.443 > 10.6.13.133.52430: Flags [P.], seq 2553:2591, ack 461, win 2051, length 38
2025-06-14 00:34:00.494326 IP 52.156.123.84.443 > 10.6.13.133.52430: Flags [.], ack 673, win 2050, length 0
2025-06-14 00:34:00.494327 IP 52.156.123.84.443 > 10.6.13.133.52430: Flags [P.], seq 2591:3168, ack 673, win 2050, length 577
2025-06-14 00:34:00.494464 IP 10.6.13.133.52430 > 52.156.123.84.443: Flags [.], ack 3168, win 253, length 0
2025-06-14 00:34:00.494712 IP 10.6.13.133.52430 > 52.156.123.84.443: Flags [F.], seq 673, ack 3168, win 253, length 0
2025-06-14 00:34:00.511739 IP 23.192.223.206.80 > 10.6.13.133.52431: Flags [.], ack 112, win 502, length 0
2025-06-14 00:34:00.511740 IP 23.192.223.206.80 > 10.6.13.133.52431: Flags [P.], seq 1:188, ack 112, win 502, length 187: HTTP: HTTP/1.1 200 OK
2025-06-14 00:34:00.511741 IP 23.192.223.206.80 > 10.6.13.133.52431: Flags [F.], seq 188, ack 112, win 502, length 0
2025-06-14 00:34:00.511742 IP 10.6.13.133.52431 > 23.192.223.206.80: Flags [.], ack 189, win 255, length 0
2025-06-14 00:34:00.511743 IP 10.6.13.133.52431 > 23.192.223.206.80: Flags [F.], seq 112, ack 189, win 255, length 0
2025-06-14 00:34:00.541541 IP 23.192.223.206.80 > 10.6.13.133.52431: Flags [.], ack 113, win 502, length 0
2025-06-14 00:34:00.575741 IP 52.156.123.84.443 > 10.6.13.133.52430: Flags [F.], seq 3168, ack 674, win 2050, length 0
2025-06-14 00:34:00.575743 IP 10.6.13.133.52430 > 52.156.123.84.443: Flags [.], ack 3169, win 253, length 0
2025-06-14 00:34:00.793839 ARP, Request who-has 10.6.13.133 tell 10.6.13.133, length 46
2025-06-14 00:34:01.066877 IP 10.6.13.133.53495 > 239.255.255.250.1900: UDP, length 137
2025-06-14 00:34:01.114334 IP 10.6.13.133.137 > 10.6.13.255.137: UDP, length 68
2025-06-14 00:34:01.155378 IP 10.6.13.133.65196 > 10.6.13.3.53: 6991+ A? client.wns.windows.com. (40)
2025-06-14 00:34:01.200777 IP 10.6.13.3.53 > 10.6.13.133.65196: 6991 2/0/0 CNAME wns.notify.trafficmanager.net., A 104.208.203.90 (99)
2025-06-14 00:34:01.201398 IP 10.6.13.133.52432 > 104.208.203.90.443: Flags [S], seq 3521634059, win 65535, options [mss 1460,nop,wscale 8,nop,nop,sackOK], length 0
2025-06-14 00:34:01.275740 IP 104.208.203.90.443 > 10.6.13.133.52432: Flags [S.], seq 1107463918, ack 3521634060, win 8192, options [mss 1396,nop,wscale 0,nop,nop,sackOK], length 0
2025-06-14 00:34:01.275742 IP 10.6.13.133.52432 > 104.208.203.90.443: Flags [.], ack 1, win 255, length 0
2025-06-14 00:34:01.277021 IP 10.6.13.133.52432 > 104.208.203.90.443: Flags [P.], seq 1:179, ack 1, win 255, length 178
2025-06-14 00:34:01.346590 IP 104.208.203.90.443 > 10.6.13.133.52432: Flags [.], seq 1:1377, ack 179, win 8014, length 1376
2025-06-14 00:34:01.346593 IP 104.208.203.90.443 > 10.6.13.133.52432: Flags [P.], seq 1377:1461, ack 179, win 8014, length 84
2025-06-14 00:34:01.346786 IP 104.208.203.90.443 > 10.6.13.133.52432: Flags [.], seq 1461:2837, ack 179, win 8014, length 1376
2025-06-14 00:34:01.346788 IP 104.208.203.90.443 > 10.6.13.133.52432: Flags [P.], seq 2837:2921, ack 179, win 8014, length 84
2025-06-14 00:34:01.346790 IP 10.6.13.133.52432 > 104.208.203.90.443: Flags [.], ack 1461, win 255, length 0
2025-06-14 00:34:01.346791 IP 10.6.13.133.52432 > 104.208.203.90.443: Flags [.], ack 2921, win 255, length 0
2025-06-14 00:34:01.347064 IP 104.208.203.90.443 > 10.6.13.133.52432: Flags [P.], seq 2921:4084, ack 179, win 8014, length 1163
2025-06-14 00:34:01.349748 IP 10.6.13.133.52432 > 104.208.203.90.443: Flags [P.], seq 179:337, ack 4084, win 251, length 158
2025-06-14 00:34:01.421787 IP 104.208.203.90.443 > 10.6.13.133.52432: Flags [P.], seq 4084:4135, ack 337, win 7856, length 51
2025-06-14 00:34:01.424735 IP 10.6.13.133.52432 > 104.208.203.90.443: Flags [P.], seq 337:697, ack 4135, win 251, length 360
2025-06-14 00:34:01.424737 IP 10.6.13.133.52432 > 104.208.203.90.443: Flags [.], seq 697:2093, ack 4135, win 251, length 1396
2025-06-14 00:34:01.424739 IP 10.6.13.133.52432 > 104.208.203.90.443: Flags [P.], seq 2093:2110, ack 4135, win 251, length 17
2025-06-14 00:34:01.424740 IP 10.6.13.133.52432 > 104.208.203.90.443: Flags [P.], seq 2110:2357, ack 4135, win 251, length 247
2025-06-14 00:34:01.506789 IP 104.208.203.90.443 > 10.6.13.133.52432: Flags [P.], seq 4135:4415, ack 697, win 7496, length 280
2025-06-14 00:34:01.506791 IP 104.208.203.90.443 > 10.6.13.133.52432: Flags [.], ack 2093, win 8192, length 0
2025-06-14 00:34:01.506792 IP 10.6.13.133.52432 > 104.208.203.90.443: Flags [.], ack 4415, win 255, length 0
2025-06-14 00:34:01.507072 IP 104.208.203.90.443 > 10.6.13.133.52432: Flags [.], ack 2110, win 8175, length 0
2025-06-14 00:34:01.507074 IP 104.208.203.90.443 > 10.6.13.133.52432: Flags [P.], seq 4415:4516, ack 2110, win 8175, length 101
2025-06-14 00:34:01.507075 IP 104.208.203.90.443 > 10.6.13.133.52432: Flags [P.], seq 4516:4694, ack 2357, win 7928, length 178
2025-06-14 00:34:01.507076 IP 10.6.13.133.52432 > 104.208.203.90.443: Flags [.], ack 4516, win 255, length 0
2025-06-14 00:34:01.513898 IP 10.6.13.133.52432 > 104.208.203.90.443: Flags [P.], seq 2357:2576, ack 4694, win 254, length 219
2025-06-14 00:34:01.581762 IP 104.208.203.90.443 > 10.6.13.133.52432: Flags [P.], seq 4694:4795, ack 2576, win 7709, length 101
2025-06-14 00:34:01.626875 IP 10.6.13.133.52432 > 104.208.203.90.443: Flags [.], ack 4795, win 254, length 0
2025-06-14 00:34:01.900400 IP 10.6.13.133.138 > 10.6.13.255.138: UDP, length 186
2025-06-14 00:34:01.906286 IP 10.6.13.133.138 > 10.6.13.255.138: UDP, length 201
2025-06-14 00:34:02.052301 IP 10.6.13.133.53495 > 239.255.255.250.1900: UDP, length 137
2025-06-14 00:34:02.066694 IP 10.6.13.133.53495 > 239.255.255.250.1900: UDP, length 137
2025-06-14 00:34:02.092065 IP 10.6.13.133.53495 > 239.255.255.250.1900: UDP, length 137
2025-06-14 00:34:03.400363 IP 10.6.13.133.138 > 10.6.13.255.138: UDP, length 186
2025-06-14 00:34:04.401877 ARP, Request who-has 10.6.13.1 tell 10.6.13.133, length 46
2025-06-14 00:34:04.401879 ARP, Reply 10.6.13.1 is-at 00:02:ba:54:95:22, length 46
2025-06-14 00:34:04.417011 ARP, Request who-has 10.6.13.3 tell 10.6.13.133, length 46
2025-06-14 00:34:04.417013 ARP, Reply 10.6.13.3 is-at 00:26:b9:71:ad:36, length 46
2025-06-14 00:34:04.433191 IP 10.6.13.133.61884 > 10.6.13.3.53: 49341+ A? dns.msftncsi.com. (34)
2025-06-14 00:34:04.474739 IP 10.6.13.3.53 > 10.6.13.133.61884: 49341 1/0/0 A 131.107.255.255 (50)
2025-06-14 00:34:04.614702 ARP, Request who-has 10.6.13.133 (24:77:03:ac:97:df) tell 10.6.13.1, length 46
2025-06-14 00:34:04.614704 ARP, Reply 10.6.13.133 is-at 24:77:03:ac:97:df, length 46
2025-06-14 00:34:04.652031 ARP, Request who-has 10.6.13.133 (24:77:03:ac:97:df) tell 10.6.13.3, length 46
2025-06-14 00:34:04.652032 ARP, Reply 10.6.13.133 is-at 24:77:03:ac:97:df, length 46
2025-06-14 00:34:04.913896 IP 10.6.13.133.138 > 10.6.13.255.138: UDP, length 186
2025-06-14 00:34:05.056815 IP 10.6.13.133.53495 > 239.255.255.250.1900: UDP, length 137
2025-06-14 00:34:06.414718 IP 10.6.13.133.138 > 10.6.13.255.138: UDP, length 186
2025-06-14 00:34:07.930155 IP 10.6.13.133.138 > 10.6.13.255.138: UDP, length 198
2025-06-14 00:34:08.057401 IP 10.6.13.133.53495 > 239.255.255.250.1900: UDP, length 137
2025-06-14 00:34:08.934403 IP 10.6.13.133.138 > 10.6.13.255.138: UDP, length 198
2025-06-14 00:34:08.935667 IP 10.6.13.133.123 > 10.6.13.3.123: NTPv3, Client, length 120
2025-06-14 00:34:08.937328 IP 10.6.13.3.123 > 10.6.13.133.123: NTPv3, Server, length 120
2025-06-14 00:34:09.909388 IP 10.6.13.133.52433 > 10.6.13.3.88: Flags [S], seq 4147966644, win 65535, options [mss 1460,nop,wscale 8,nop,nop,sackOK], length 0
2025-06-14 00:34:09.909391 IP 10.6.13.3.88 > 10.6.13.133.52433: Flags [S.], seq 2015066365, ack 4147966645, win 65535, options [mss 1460,nop,wscale 8,nop,nop,sackOK], length 0
2025-06-14 00:34:09.909391 IP 10.6.13.133.52433 > 10.6.13.3.88: Flags [.], ack 1, win 255, length 0
2025-06-14 00:34:09.909554 IP 10.6.13.133.52433 > 10.6.13.3.88: Flags [P.], seq 1:225, ack 1, win 255, length 224
2025-06-14 00:34:09.910635 IP 10.6.13.3.88 > 10.6.13.133.52433: Flags [P.], seq 1:196, ack 225, win 4099, length 195
2025-06-14 00:34:09.910637 IP 10.6.13.133.52433 > 10.6.13.3.88: Flags [F.], seq 225, ack 196, win 255, length 0
2025-06-14 00:34:09.910711 IP 10.6.13.3.88 > 10.6.13.133.52433: Flags [.], ack 226, win 4099, length 0
2025-06-14 00:34:09.910777 IP 10.6.13.3.88 > 10.6.13.133.52433: Flags [R.], seq 196, ack 226, win 0, length 0
2025-06-14 00:34:09.919034 IP 10.6.13.133.52434 > 10.6.13.3.88: Flags [S], seq 823323742, win 65535, options [mss 1460,nop,wscale 8,nop,nop,sackOK], length 0
2025-06-14 00:34:09.919036 IP 10.6.13.3.88 > 10.6.13.133.52434: Flags [S.], seq 1298264510, ack 823323743, win 65535, options [mss 1460,nop,wscale 8,nop,nop,sackOK], length 0
2025-06-14 00:34:09.919037 IP 10.6.13.133.52434 > 10.6.13.3.88: Flags [.], ack 1, win 255, length 0
2025-06-14 00:34:09.919195 IP 10.6.13.133.52434 > 10.6.13.3.88: Flags [P.], seq 1:305, ack 1, win 255, length 304
2025-06-14 00:34:09.921146 IP 10.6.13.3.88 > 10.6.13.133.52434: Flags [.], seq 1:1461, ack 305, win 4099, length 1460
2025-06-14 00:34:09.921148 IP 10.6.13.3.88 > 10.6.13.133.52434: Flags [P.], seq 1461:1709, ack 305, win 4099, length 248
2025-06-14 00:34:09.921150 IP 10.6.13.133.52434 > 10.6.13.3.88: Flags [.], ack 1709, win 255, length 0
2025-06-14 00:34:09.921151 IP 10.6.13.133.52434 > 10.6.13.3.88: Flags [F.], seq 305, ack 1709, win 255, length 0
2025-06-14 00:34:09.921152 IP 10.6.13.3.88 > 10.6.13.133.52434: Flags [.], ack 306, win 4099, length 0
2025-06-14 00:34:09.921331 IP 10.6.13.3.88 > 10.6.13.133.52434: Flags [R.], seq 1709, ack 306, win 0, length 0
2025-06-14 00:34:09.921644 IP 10.6.13.133.52435 > 10.6.13.3.88: Flags [S], seq 3660748529, win 65535, options [mss 1460,nop,wscale 8,nop,nop,sackOK], length 0
2025-06-14 00:34:09.921645 IP 10.6.13.3.88 > 10.6.13.133.52435: Flags [S.], seq 840717612, ack 3660748530, win 65535, options [mss 1460,nop,wscale 8,nop,nop,sackOK], length 0
2025-06-14 00:34:09.921646 IP 10.6.13.133.65196 > 10.6.13.3.53: 56267+ SRV? _ldap._tcp.Default-First-Site-Name._sites.massfriction.com. (76)
2025-06-14 00:34:09.921648 IP 10.6.13.133.52435 > 10.6.13.3.88: Flags [.], ack 1, win 255, length 0
2025-06-14 00:34:09.922091 IP 10.6.13.133.52435 > 10.6.13.3.88: Flags [.], seq 1:1461, ack 1, win 255, length 1460
2025-06-14 00:34:09.922093 IP 10.6.13.133.52435 > 10.6.13.3.88: Flags [P.], seq 1461:1631, ack 1, win 255, length 170
2025-06-14 00:34:09.922094 IP 10.6.13.3.53 > 10.6.13.133.65196: 56267* 1/0/1 SRV win-dql4wfwjxq4.massfriction.com.:389 0 100 (144)
2025-06-14 00:34:09.922096 IP 10.6.13.3.88 > 10.6.13.133.52435: Flags [.], ack 1631, win 4100, length 0
2025-06-14 00:34:09.923154 IP 10.6.13.133.61885 > 10.6.13.3.389: UDP, length 227
2025-06-14 00:34:09.923378 IP 10.6.13.3.389 > 10.6.13.133.61885: UDP, length 202
2025-06-14 00:34:09.924923 IP 10.6.13.3.88 > 10.6.13.133.52435: Flags [.], seq 1:1461, ack 1631, win 4100, length 1460
2025-06-14 00:34:09.924926 IP 10.6.13.3.88 > 10.6.13.133.52435: Flags [P.], seq 1461:1646, ack 1631, win 4100, length 185
2025-06-14 00:34:09.924927 IP 10.6.13.133.52435 > 10.6.13.3.88: Flags [.], ack 1646, win 255, length 0
2025-06-14 00:34:09.925073 IP 10.6.13.133.52435 > 10.6.13.3.88: Flags [F.], seq 1631, ack 1646, win 255, length 0
2025-06-14 00:34:09.925106 IP 10.6.13.3.88 > 10.6.13.133.52435: Flags [.], ack 1632, win 4100, length 0
2025-06-14 00:34:09.925107 IP 10.6.13.3.88 > 10.6.13.133.52435: Flags [R.], seq 1646, ack 1632, win 0, length 0
2025-06-14 00:34:09.945225 IP 10.6.13.133.138 > 10.6.13.255.138: UDP, length 198
2025-06-14 00:34:10.120593 IP 10.6.13.133.52436 > 10.6.13.3.445: Flags [S], seq 3793168674, win 65535, options [mss 1460,nop,wscale 8,nop,nop,sackOK], length 0
2025-06-14 00:34:10.120595 IP 10.6.13.3.445 > 10.6.13.133.52436: Flags [S.], seq 1041590417, ack 3793168675, win 65535, options [mss 1460,nop,wscale 8,nop,nop,sackOK], length 0
2025-06-14 00:34:10.120596 IP 10.6.13.133.52436 > 10.6.13.3.445: Flags [.], ack 1, win 255, length 0
2025-06-14 00:34:10.121928 IP 10.6.13.133.52437 > 10.6.13.3.135: Flags [S], seq 3742426180, win 65535, options [mss 1460,nop,wscale 8,nop,nop,sackOK], length 0
2025-06-14 00:34:10.121930 IP 10.6.13.3.135 > 10.6.13.133.52437: Flags [S.], seq 2660003708, ack 3742426181, win 65535, options [mss 1460,nop,wscale 8,nop,nop,sackOK], length 0
2025-06-14 00:34:10.122052 IP 10.6.13.133.52437 > 10.6.13.3.135: Flags [.], ack 1, win 255, length 0
2025-06-14 00:34:10.122053 IP 10.6.13.133.52437 > 10.6.13.3.135: Flags [P.], seq 1:161, ack 1, win 255, length 160
2025-06-14 00:34:10.122431 IP 10.6.13.3.135 > 10.6.13.133.52437: Flags [P.], seq 1:109, ack 161, win 4099, length 108
2025-06-14 00:34:10.122627 IP 10.6.13.133.52437 > 10.6.13.3.135: Flags [P.], seq 161:329, ack 109, win 255, length 168
2025-06-14 00:34:10.122629 IP 10.6.13.133.52436 > 10.6.13.3.445: Flags [P.], seq 1:160, ack 1, win 255, length 159
2025-06-14 00:34:10.123288 IP 10.6.13.3.135 > 10.6.13.133.52437: Flags [P.], seq 109:377, ack 329, win 4099, length 268
2025-06-14 00:34:10.123291 IP 10.6.13.3.445 > 10.6.13.133.52436: Flags [P.], seq 1:253, ack 160, win 4099, length 252
2025-06-14 00:34:10.123540 IP 10.6.13.133.52436 > 10.6.13.3.445: Flags [P.], seq 160:488, ack 253, win 255, length 328
2025-06-14 00:34:10.123732 IP 10.6.13.133.52438 > 10.6.13.3.49669: Flags [S], seq 2886039092, win 65535, options [mss 1460,nop,wscale 8,nop,nop,sackOK], length 0
2025-06-14 00:34:10.123734 IP 10.6.13.3.49669 > 10.6.13.133.52438: Flags [S.], seq 2303531697, ack 2886039093, win 65535, options [mss 1460,nop,wscale 8,nop,nop,sackOK], length 0
2025-06-14 00:34:10.123928 IP 10.6.13.133.52438 > 10.6.13.3.49669: Flags [.], ack 1, win 255, length 0
2025-06-14 00:34:10.124587 IP 10.6.13.3.445 > 10.6.13.133.52436: Flags [P.], seq 253:629, ack 488, win 4098, length 376
2025-06-14 00:34:10.126027 IP 10.6.13.133.52439 > 10.6.13.3.88: Flags [S], seq 1353638236, win 65535, options [mss 1460,nop,wscale 8,nop,nop,sackOK], length 0
2025-06-14 00:34:10.126029 IP 10.6.13.3.88 > 10.6.13.133.52439: Flags [S.], seq 1970800030, ack 1353638237, win 65535, options [mss 1460,nop,wscale 8,nop,nop,sackOK], length 0
2025-06-14 00:34:10.126154 IP 10.6.13.133.52439 > 10.6.13.3.88: Flags [.], ack 1, win 255, length 0
2025-06-14 00:34:10.126488 IP 10.6.13.133.52439 > 10.6.13.3.88: Flags [.], seq 1:1461, ack 1, win 255, length 1460
2025-06-14 00:34:10.126489 IP 10.6.13.133.52439 > 10.6.13.3.88: Flags [P.], seq 1461:1786, ack 1, win 255, length 325
2025-06-14 00:34:10.126490 IP 10.6.13.3.88 > 10.6.13.133.52439: Flags [.], ack 1786, win 4100, length 0
2025-06-14 00:34:10.127429 IP 10.6.13.133.52440 > 10.6.13.3.88: Flags [S], seq 2919608516, win 65535, options [mss 1460,nop,wscale 8,nop,nop,sackOK], length 0
2025-06-14 00:34:10.127431 IP 10.6.13.3.88 > 10.6.13.133.52440: Flags [S.], seq 3363000059, ack 2919608517, win 65535, options [mss 1460,nop,wscale 8,nop,nop,sackOK], length 0
2025-06-14 00:34:10.127432 IP 10.6.13.133.52440 > 10.6.13.3.88: Flags [.], ack 1, win 255, length 0
2025-06-14 00:34:10.127694 IP 10.6.13.133.52440 > 10.6.13.3.88: Flags [.], seq 1:1461, ack 1, win 255, length 1460
2025-06-14 00:34:10.127696 IP 10.6.13.133.52440 > 10.6.13.3.88: Flags [P.], seq 1461:1804, ack 1, win 255, length 343
2025-06-14 00:34:10.127697 IP 10.6.13.3.88 > 10.6.13.133.52440: Flags [.], ack 1804, win 4100, length 0
2025-06-14 00:34:10.130106 IP 10.6.13.3.88 > 10.6.13.133.52439: Flags [.], seq 1:1461, ack 1786, win 4100, length 1460
2025-06-14 00:34:10.130108 IP 10.6.13.3.88 > 10.6.13.133.52439: Flags [P.], seq 1461:1752, ack 1786, win 4100, length 291
2025-06-14 00:34:10.130110 IP 10.6.13.133.52439 > 10.6.13.3.88: Flags [.], ack 1752, win 255, length 0
2025-06-14 00:34:10.130111 IP 10.6.13.133.52439 > 10.6.13.3.88: Flags [F.], seq 1786, ack 1752, win 255, length 0
2025-06-14 00:34:10.130112 IP 10.6.13.3.88 > 10.6.13.133.52439: Flags [.], ack 1787, win 4100, length 0
2025-06-14 00:34:10.130186 IP 10.6.13.3.88 > 10.6.13.133.52439: Flags [R.], seq 1752, ack 1787, win 0, length 0
2025-06-14 00:34:10.130330 IP 10.6.13.133.52441 > 10.6.13.3.88: Flags [S], seq 3349488764, win 65535, options [mss 1460,nop,wscale 8,nop,nop,sackOK], length 0
2025-06-14 00:34:10.130331 IP 10.6.13.3.88 > 10.6.13.133.52441: Flags [S.], seq 884060046, ack 3349488765, win 65535, options [mss 1460,nop,wscale 8,nop,nop,sackOK], length 0
2025-06-14 00:34:10.130586 IP 10.6.13.133.52441 > 10.6.13.3.88: Flags [.], ack 1, win 255, length 0
2025-06-14 00:34:10.130742 IP 10.6.13.3.88 > 10.6.13.133.52440: Flags [.], seq 1:1461, ack 1804, win 4100, length 1460
2025-06-14 00:34:10.130788 IP 10.6.13.133.52441 > 10.6.13.3.88: Flags [.], seq 1:1461, ack 1, win 255, length 1460
2025-06-14 00:34:10.130953 IP 10.6.13.133.52441 > 10.6.13.3.88: Flags [P.], seq 1461:1573, ack 1, win 255, length 112
2025-06-14 00:34:10.130954 IP 10.6.13.3.88 > 10.6.13.133.52440: Flags [P.], seq 1461:1772, ack 1804, win 4100, length 311
2025-06-14 00:34:10.130955 IP 10.6.13.133.52440 > 10.6.13.3.88: Flags [.], ack 1772, win 255, length 0
2025-06-14 00:34:10.130957 IP 10.6.13.133.52440 > 10.6.13.3.88: Flags [F.], seq 1804, ack 1772, win 255, length 0
2025-06-14 00:34:10.130957 IP 10.6.13.3.88 > 10.6.13.133.52441: Flags [.], ack 1573, win 4100, length 0
2025-06-14 00:34:10.130958 IP 10.6.13.3.88 > 10.6.13.133.52440: Flags [.], ack 1805, win 4100, length 0
2025-06-14 00:34:10.130959 IP 10.6.13.3.88 > 10.6.13.133.52440: Flags [R.], seq 1772, ack 1805, win 0, length 0
2025-06-14 00:34:10.131524 IP 10.6.13.133.52438 > 10.6.13.3.49669: Flags [.], seq 1:1461, ack 1, win 255, length 1460
2025-06-14 00:34:10.131526 IP 10.6.13.133.52438 > 10.6.13.3.49669: Flags [P.], seq 1461:2154, ack 1, win 255, length 693
2025-06-14 00:34:10.131528 IP 10.6.13.3.49669 > 10.6.13.133.52438: Flags [.], ack 2154, win 4100, length 0
2025-06-14 00:34:10.132306 IP 10.6.13.3.88 > 10.6.13.133.52441: Flags [.], seq 1:1461, ack 1573, win 4100, length 1460
2025-06-14 00:34:10.132307 IP 10.6.13.3.88 > 10.6.13.133.52441: Flags [P.], seq 1461:1601, ack 1573, win 4100, length 140
2025-06-14 00:34:10.132309 IP 10.6.13.133.52441 > 10.6.13.3.88: Flags [.], ack 1601, win 255, length 0
2025-06-14 00:34:10.132310 IP 10.6.13.133.52441 > 10.6.13.3.88: Flags [F.], seq 1573, ack 1601, win 255, length 0
2025-06-14 00:34:10.132311 IP 10.6.13.3.88 > 10.6.13.133.52441: Flags [.], ack 1574, win 4100, length 0
2025-06-14 00:34:10.132421 IP 10.6.13.3.88 > 10.6.13.133.52441: Flags [R.], seq 1601, ack 1574, win 0, length 0
2025-06-14 00:34:10.133019 IP 10.6.13.133.52436 > 10.6.13.3.445: Flags [.], seq 488:1948, ack 629, win 253, length 1460
2025-06-14 00:34:10.133021 IP 10.6.13.133.52436 > 10.6.13.3.445: Flags [.], seq 1948:3408, ack 629, win 253, length 1460
2025-06-14 00:34:10.133023 IP 10.6.13.133.52436 > 10.6.13.3.445: Flags [P.], seq 3408:4064, ack 629, win 253, length 656
2025-06-14 00:34:10.133156 IP 10.6.13.3.49669 > 10.6.13.133.52438: Flags [P.], seq 1:286, ack 2154, win 4100, length 285
2025-06-14 00:34:10.133157 IP 10.6.13.3.445 > 10.6.13.133.52436: Flags [.], ack 3408, win 4100, length 0
2025-06-14 00:34:10.133357 IP 10.6.13.133.52438 > 10.6.13.3.49669: Flags [P.], seq 2154:2374, ack 286, win 254, length 220
2025-06-14 00:34:10.133983 IP 10.6.13.3.49669 > 10.6.13.133.52438: Flags [P.], seq 286:391, ack 2374, win 4099, length 105
2025-06-14 00:34:10.134208 IP 10.6.13.133.52438 > 10.6.13.3.49669: Flags [P.], seq 2374:2642, ack 391, win 254, length 268
2025-06-14 00:34:10.134681 IP 10.6.13.3.49669 > 10.6.13.133.52438: Flags [P.], seq 391:595, ack 2642, win 4098, length 204
2025-06-14 00:34:10.134977 IP 10.6.13.133.52438 > 10.6.13.3.49669: Flags [P.], seq 2642:2910, ack 595, win 253, length 268
2025-06-14 00:34:10.134978 IP 10.6.13.3.445 > 10.6.13.133.52436: Flags [P.], seq 629:890, ack 4064, win 4097, length 261
2025-06-14 00:34:10.135537 IP 10.6.13.133.52436 > 10.6.13.3.445: Flags [P.], seq 4064:4218, ack 890, win 252, length 154
2025-06-14 00:34:10.135539 IP 10.6.13.3.49669 > 10.6.13.133.52438: Flags [P.], seq 595:975, ack 2910, win 4097, length 380
2025-06-14 00:34:10.135712 IP 10.6.13.3.445 > 10.6.13.133.52436: Flags [P.], seq 890:974, ack 4218, win 4097, length 84
2025-06-14 00:34:10.135713 IP 10.6.13.133.52436 > 10.6.13.3.445: Flags [P.], seq 4218:4342, ack 974, win 252, length 124
2025-06-14 00:34:10.135974 IP 10.6.13.133.52438 > 10.6.13.3.49669: Flags [P.], seq 2910:3178, ack 975, win 252, length 268
2025-06-14 00:34:10.135975 IP 10.6.13.133.52436 > 10.6.13.3.445: Flags [P.], seq 4342:4474, ack 974, win 252, length 132
2025-06-14 00:34:10.136068 IP 10.6.13.3.445 > 10.6.13.133.52436: Flags [.], ack 4474, win 4096, length 0
2025-06-14 00:34:10.136104 IP 10.6.13.3.445 > 10.6.13.133.52436: Flags [P.], seq 974:1242, ack 4474, win 4096, length 268
2025-06-14 00:34:10.136358 IP 10.6.13.3.445 > 10.6.13.133.52436: Flags [P.], seq 1242:1398, ack 4474, win 4096, length 156
2025-06-14 00:34:10.136360 IP 10.6.13.133.52436 > 10.6.13.3.445: Flags [.], ack 1398, win 250, length 0
2025-06-14 00:34:10.136509 IP 10.6.13.3.49669 > 10.6.13.133.52438: Flags [P.], seq 975:1339, ack 3178, win 4096, length 364
2025-06-14 00:34:10.136795 IP 10.6.13.133.52438 > 10.6.13.3.49669: Flags [P.], seq 3178:3318, ack 1339, win 250, length 140
2025-06-14 00:34:10.136854 IP 10.6.13.3.49669 > 10.6.13.133.52438: Flags [P.], seq 1339:1479, ack 3318, win 4096, length 140
2025-06-14 00:34:10.136892 IP 10.6.13.133.52436 > 10.6.13.3.445: Flags [P.], seq 4474:4582, ack 1398, win 250, length 108
2025-06-14 00:34:10.137070 IP 10.6.13.3.445 > 10.6.13.133.52436: Flags [P.], seq 1398:1498, ack 4582, win 4095, length 100
2025-06-14 00:34:10.137252 IP 10.6.13.133.52436 > 10.6.13.3.445: Flags [P.], seq 4582:4858, ack 1498, win 255, length 276
2025-06-14 00:34:10.137254 IP 10.6.13.3.445 > 10.6.13.133.52436: Flags [P.], seq 1498:1582, ack 4858, win 4094, length 84
2025-06-14 00:34:10.137453 IP 10.6.13.133.52436 > 10.6.13.3.445: Flags [P.], seq 4858:4975, ack 1582, win 255, length 117
2025-06-14 00:34:10.137612 IP 10.6.13.3.445 > 10.6.13.133.52436: Flags [P.], seq 1582:1782, ack 4975, win 4100, length 200
2025-06-14 00:34:10.137629 IP 10.6.13.133.52436 > 10.6.13.3.445: Flags [P.], seq 4975:5247, ack 1782, win 254, length 272
2025-06-14 00:34:10.138030 IP 10.6.13.3.445 > 10.6.13.133.52436: Flags [P.], seq 1782:1962, ack 5247, win 4099, length 180
2025-06-14 00:34:10.138225 IP 10.6.13.133.52436 > 10.6.13.3.445: Flags [P.], seq 5247:5423, ack 1962, win 254, length 176
2025-06-14 00:34:10.138471 IP 10.6.13.3.445 > 10.6.13.133.52436: Flags [P.], seq 1962:2286, ack 5423, win 4098, length 324
2025-06-14 00:34:10.138659 IP 10.6.13.133.52436 > 10.6.13.3.445: Flags [P.], seq 5423:5659, ack 2286, win 252, length 236
2025-06-14 00:34:10.138908 IP 10.6.13.3.445 > 10.6.13.133.52436: Flags [P.], seq 2286:2470, ack 5659, win 4097, length 184
2025-06-14 00:34:10.139134 IP 10.6.13.133.52436 > 10.6.13.3.445: Flags [P.], seq 5659:5863, ack 2470, win 252, length 204
2025-06-14 00:34:10.139385 IP 10.6.13.3.445 > 10.6.13.133.52436: Flags [P.], seq 2470:2634, ack 5863, win 4097, length 164
2025-06-14 00:34:10.139585 IP 10.6.13.133.52436 > 10.6.13.3.445: Flags [P.], seq 5863:6055, ack 2634, win 251, length 192
2025-06-14 00:34:10.139859 IP 10.6.13.3.445 > 10.6.13.133.52436: Flags [P.], seq 2634:2798, ack 6055, win 4096, length 164
2025-06-14 00:34:10.140083 IP 10.6.13.133.52436 > 10.6.13.3.445: Flags [P.], seq 6055:6305, ack 2798, win 250, length 250
2025-06-14 00:34:10.140358 IP 10.6.13.3.445 > 10.6.13.133.52436: Flags [P.], seq 2798:3002, ack 6305, win 4095, length 204
2025-06-14 00:34:10.140597 IP 10.6.13.133.52436 > 10.6.13.3.445: Flags [P.], seq 6305:6481, ack 3002, win 255, length 176
2025-06-14 00:34:10.140913 IP 10.6.13.3.445 > 10.6.13.133.52436: Flags [P.], seq 3002:3166, ack 6481, win 4100, length 164
2025-06-14 00:34:10.141162 IP 10.6.13.133.52436 > 10.6.13.3.445: Flags [P.], seq 6481:6653, ack 3166, win 255, length 172
2025-06-14 00:34:10.141586 IP 10.6.13.3.445 > 10.6.13.133.52436: Flags [P.], seq 3166:3974, ack 6653, win 4099, length 808
2025-06-14 00:34:10.141838 IP 10.6.13.133.52436 > 10.6.13.3.445: Flags [P.], seq 6653:6825, ack 3974, win 252, length 172
2025-06-14 00:34:10.142182 IP 10.6.13.3.445 > 10.6.13.133.52436: Flags [P.], seq 3974:4338, ack 6825, win 4099, length 364
2025-06-14 00:34:10.142398 IP 10.6.13.133.52436 > 10.6.13.3.445: Flags [P.], seq 6825:6993, ack 4338, win 250, length 168
2025-06-14 00:34:10.142615 IP 10.6.13.3.445 > 10.6.13.133.52436: Flags [P.], seq 4338:4522, ack 6993, win 4098, length 184
2025-06-14 00:34:10.142840 IP 10.6.13.133.52436 > 10.6.13.3.445: Flags [P.], seq 6993:7281, ack 4522, win 255, length 288
2025-06-14 00:34:10.143039 IP 10.6.13.3.445 > 10.6.13.133.52436: Flags [P.], seq 4522:4694, ack 7281, win 4097, length 172
2025-06-14 00:34:10.143231 IP 10.6.13.133.52436 > 10.6.13.3.445: Flags [P.], seq 7281:7449, ack 4694, win 255, length 168
2025-06-14 00:34:10.143419 IP 10.6.13.3.445 > 10.6.13.133.52436: Flags [P.], seq 4694:4858, ack 7449, win 4096, length 164
2025-06-14 00:34:10.143631 IP 10.6.13.133.52436 > 10.6.13.3.445: Flags [P.], seq 7449:7617, ack 4858, win 254, length 168
2025-06-14 00:34:10.143833 IP 10.6.13.3.445 > 10.6.13.133.52436: Flags [P.], seq 4858:5022, ack 7617, win 4096, length 164
2025-06-14 00:34:10.144042 IP 10.6.13.133.52436 > 10.6.13.3.445: Flags [P.], seq 7617:7785, ack 5022, win 254, length 168
2025-06-14 00:34:10.144282 IP 10.6.13.3.445 > 10.6.13.133.52436: Flags [P.], seq 5022:5186, ack 7785, win 4095, length 164
2025-06-14 00:34:10.144519 IP 10.6.13.133.52436 > 10.6.13.3.445: Flags [P.], seq 7785:7953, ack 5186, win 253, length 168
2025-06-14 00:34:10.144521 IP 10.6.13.133.52437 > 10.6.13.3.135: Flags [P.], seq 329:497, ack 377, win 254, length 168
