2025-07-20 14:00:00.228603 IP 150.165.103.133.443 > 163.62.4.236.54372: Flags [P.], seq 2408409918:2408411378, ack 41863130, win 32850, length 1460
2025-07-20 14:00:00.228605 IP 192.242.209.255.5830 > 52.107.241.218.443: Flags [P.], seq 229435932:229435963, ack 245183773, win 2048, options [nop,nop,TS val 1083882715 ecr 5831867], length 31
2025-07-20 14:00:00.228606 IP 150.165.17.177.62903 > 45.121.183.28.443: Flags [.], ack 2535472570, win 4095, options [nop,nop,sack 4 {115341:134321}{1461:70081}{78841:110961}{74461:77381}], length 0
2025-07-20 14:00:00.228607 IP 204.188.203.88.63131 > 163.61.199.139.46831: Flags [S.], seq 1073892933, ack 1098101557, win 0, length 0
2025-07-20 14:00:00.228608 IP 157.175.59.57.42879 > 199.231.105.144.80: Flags [.], ack 854915720, win 44, options [nop,nop,TS val 973120 ecr 2926985532], length 0
2025-07-20 14:00:00.228609 IP 202.244.39.51.56172 > 13.154.148.235.443: Flags [.], seq 635040265:635041647, ack 2202738045, win 1020, length 1382
2025-07-20 14:00:00.228610 IP 150.165.17.177.62903 > 45.121.183.28.443: Flags [.], ack 1, win 4095, options [nop,nop,sack 4 {115341:135781}{1461:70081}{78841:110961}{74461:77381}], length 0
2025-07-20 14:00:00.228611 IP 172.89.175.81.443 > 202.244.35.39.54604: Flags [.], ack 2721717289, win 11274, length 0
2025-07-20 14:00:00.228612 IP 150.165.103.133.443 > 163.62.4.236.54372: Flags [P.], seq 1460:8760, ack 1, win 32850, length 7300
2025-07-20 14:00:00.228614 IP 45.121.183.6.443 > 150.165.17.177.53039: Flags [.], seq 3084795363:3084801203, ack 395833334, win 2081, length 5840
2025-07-20 14:00:00.228615 IP 172.89.175.81.443 > 202.244.35.39.54604: Flags [.], ack 2825, win 11274, length 0
2025-07-20 14:00:00.228624 IP 150.165.17.177.53039 > 45.121.183.6.443: Flags [.], ack 4293641616, win 32767, options [nop,nop,sack 4 {4294186196:4294349716}{4294584776:4294628576}{4294564336:4294577476}{4294523456:4294557036}], length 0
2025-07-20 14:00:00.228626 IP 150.165.17.177.53039 > 45.121.183.6.443: Flags [.], ack 4293641616, win 32767, options [nop,nop,sack 4 {4294584776:4294630036}{4294186196:4294349716}{4294564336:4294577476}{4294523456:4294557036}], length 0
2025-07-20 14:00:00.228627 IP 150.165.17.177.53039 > 45.121.183.6.443: Flags [.], ack 4293641616, win 32767, options [nop,nop,sack 4 {4294584776:4294631496}{4294186196:4294349716}{4294564336:4294577476}{4294523456:4294557036}], length 0
2025-07-20 14:00:00.228628 IP 150.165.17.177.53039 > 45.121.183.6.443: Flags [.], ack 4293641616, win 32767, options [nop,nop,sack 4 {4294584776:4294632956}{4294186196:4294349716}{4294564336:4294577476}{4294523456:4294557036}], length 0
2025-07-20 14:00:00.228629 IP 150.165.17.177.53039 > 45.121.183.6.443: Flags [.], ack 4293641616, win 32767, options [nop,nop,sack 4 {4294584776:4294634416}{4294186196:4294349716}{4294564336:4294577476}{4294523456:4294557036}], length 0
2025-07-20 14:00:00.228631 IP 150.165.17.177.53039 > 45.121.183.6.443: Flags [.], ack 4293641616, win 32767, options [nop,nop,sack 4 {4294584776:4294635876}{4294186196:4294349716}{4294564336:4294577476}{4294523456:4294557036}], length 0
2025-07-20 14:00:00.228631 IP 150.165.17.177.53039 > 45.121.183.6.443: Flags [.], ack 4293641616, win 32767, options [nop,nop,sack 4 {4294584776:4294637336}{4294186196:4294349716}{4294564336:4294577476}{4294523456:4294557036}], length 0
2025-07-20 14:00:00.228632 IP 150.165.17.177.53039 > 45.121.183.6.443: Flags [.], ack 4293641616, win 32767, options [nop,nop,sack 4 {4294584776:4294638796}{4294186196:4294349716}{4294564336:4294577476}{4294523456:4294557036}], length 0
2025-07-20 14:00:00.228633 IP 150.165.17.177.53039 > 45.121.183.6.443: Flags [.], ack 4293641616, win 32767, options [nop,nop,sack 4 {4294584776:4294640256}{4294186196:4294349716}{4294564336:4294577476}{4294523456:4294557036}], length 0
2025-07-20 14:00:00.228634 IP 157.175.18.96.51008 > 162.130.246.227.443: Flags [P.], seq 187936416:187936422, ack 767310482, win 2050, options [nop,nop,TS val 114140101 ecr 3734486836], length 6
2025-07-20 14:00:00.228635 IP 157.175.121.225.23964 > 184.251.74.167.80: Flags [.], ack 2948805580, win 37584, options [nop,nop,TS val 240685387 ecr 3375552529], length 0
2025-07-20 14:00:00.228636 IP 150.165.17.177.53039 > 45.121.183.6.443: Flags [.], ack 4293641616, win 32767, options [nop,nop,sack 4 {4294584776:4294641716}{4294186196:4294349716}{4294564336:4294577476}{4294523456:4294557036}], length 0
2025-07-20 14:00:00.228638 IP 150.165.103.133.443 > 163.62.4.236.54372: Flags [.], seq 8760:17520, ack 1, win 32850, length 8760
2025-07-20 14:00:00.228638 IP 150.165.17.177.65498 > 45.121.183.17.443: Flags [.], ack 886180078, win 16383, options [nop,nop,sack 4 {861643:863103}{784263:855803}{1461:383981}{750683:778423}], length 0
2025-07-20 14:00:00.228639 IP 172.89.175.81.443 > 202.244.35.39.54604: Flags [.], ack 7061, win 11271, length 0
2025-07-20 14:00:00.228640 IP 150.165.17.177.65498 > 45.121.183.17.443: Flags [.], ack 1, win 16383, options [nop,nop,sack 4 {861643:864563}{784263:855803}{1461:383981}{750683:778423}], length 0
2025-07-20 14:00:00.228641 IP 203.141.114.197 > 125.119.24.196: ICMP echo request, id 38370, seq 151, length 12
2025-07-20 14:00:00.228641 IP 150.165.17.177.65498 > 45.121.183.17.443: Flags [.], ack 1, win 16383, options [nop,nop,sack 4 {861643:866023}{784263:855803}{1461:383981}{750683:778423}], length 0
2025-07-20 14:00:00.228642 IP 150.165.35.59.15918 > 125.189.101.96.4932: UDP, length 1386
2025-07-20 14:00:00.228643 IP 45.121.183.28.443 > 150.165.17.177.62903: Flags [.], seq 186881:191261, ack 0, win 163, length 4380
2025-07-20 14:00:00.228644 IP6 2001:9e3f:1e1:39f8:bd8:fb0c:e9ff:5d96.48374 > 2620:8312:a13d:f7f1:8ff:7f3:17fe:d17d.873: Flags [.], ack 3595507908, win 21975, options [nop,nop,TS val 167455202 ecr 3993455973,nop,nop,sack 3 [|tcp]>
2025-07-20 14:00:00.228645 IP 157.175.59.57.12390 > 92.95.207.65.80: Flags [.], ack 2293469499, win 23, options [nop,nop,TS val 973120 ecr 667552502], length 0
2025-07-20 14:00:00.228646 IP 203.141.114.197 > 41.31.64.203: ICMP echo request, id 38370, seq 4597, length 12
2025-07-20 14:00:00.228646 IP 203.141.114.197 > 182.144.168.208: ICMP echo request, id 38370, seq 951, length 12
2025-07-20 14:00:00.228647 IP 150.165.17.177.53039 > 45.121.183.6.443: Flags [.], ack 4293641616, win 32767, options [nop,nop,sack 4 {4294584776:4294643176}{4294186196:4294349716}{4294564336:4294577476}{4294523456:4294557036}], length 0
2025-07-20 14:00:00.228648 IP 157.175.197.208.45670 > 162.126.130.148.443: Flags [P.], seq 1704961371:1704961492, ack 3534809894, win 255, length 121
2025-07-20 14:00:00.228649 IP 202.244.39.51.56172 > 13.154.148.235.443: Flags [.], seq 1382:5528, ack 1, win 1020, length 4146
2025-07-20 14:00:00.228650 IP 157.175.59.57.42879 > 199.231.105.144.80: Flags [.], ack 2897, win 44, options [nop,nop,TS val 973120 ecr 2926985532], length 0
2025-07-20 14:00:00.228651 IP 150.165.17.177.53039 > 45.121.183.6.443: Flags [.], ack 4293641616, win 32767, options [nop,nop,sack 4 {4294584776:4294644636}{4294186196:4294349716}{4294564336:4294577476}{4294523456:4294557036}], length 0
2025-07-20 14:00:00.228652 IP 150.165.17.177.53039 > 45.121.183.6.443: Flags [.], ack 4293641616, win 32767, options [nop,nop,sack 4 {4294584776:4294646096}{4294186196:4294349716}{4294564336:4294577476}{4294523456:4294557036}], length 0
2025-07-20 14:00:00.228653 IP 202.244.39.51.56172 > 13.154.148.235.443: Flags [.], seq 5528:6910, ack 49, win 1020, length 1382
2025-07-20 14:00:00.228654 IP 150.165.17.177.53039 > 45.121.183.6.443: Flags [.], ack 4293641616, win 32767, options [nop,nop,sack 4 {4294584776:4294647556}{4294186196:4294349716}{4294564336:4294577476}{4294523456:4294557036}], length 0
2025-07-20 14:00:00.228655 IP 150.165.17.177.53039 > 45.121.183.6.443: Flags [.], ack 4293641616, win 32767, options [nop,nop,sack 4 {4294584776:4294649016}{4294186196:4294349716}{4294564336:4294577476}{4294523456:4294557036}], length 0
2025-07-20 14:00:00.228656 IP 150.165.17.177.53039 > 45.121.183.6.443: Flags [.], ack 4293641616, win 32767, options [nop,nop,sack 4 {4294584776:4294650476}{4294186196:4294349716}{4294564336:4294577476}{4294523456:4294557036}], length 0
2025-07-20 14:00:00.228657 IP 150.165.103.133.443 > 163.62.4.236.54372: Flags [.], seq 17520:20440, ack 1, win 32850, length 2920
2025-07-20 14:00:00.228663 IP 203.141.114.197 > 201.229.231.207: ICMP echo request, id 38370, seq 4597, length 12
2025-07-20 14:00:00.228664 IP6 2a01:7ffe:c0b0:c000:f7c0:f0:fbfe:9c6c.53 > 2001:93f0:2f2:1d70:bc7:c00f:1c01:505e.60511: 41203 NXDomain*-[|domain]
2025-07-20 14:00:00.228665 IP6 2001:93f0:2f2:8a0d:c3c0:a497:ef3e:1b22.52218 > 2600:9d2a:ea3f:f9fa:8e7:c70c:b814:7ddd.443: Flags [.], ack 2840309474, win 8222, length 0
2025-07-20 14:00:00.228667 IP 150.165.17.177.65498 > 45.121.183.17.443: Flags [.], ack 1, win 16383, options [nop,nop,sack 4 {861643:867483}{784263:855803}{1461:383981}{750683:778423}], length 0
2025-07-20 14:00:00.228669 IP 150.165.17.177.65498 > 45.121.183.17.443: Flags [.], ack 1, win 16383, options [nop,nop,sack 4 {861643:868943}{784263:855803}{1461:383981}{750683:778423}], length 0
2025-07-20 14:00:00.228673 IP 202.244.39.51.56172 > 13.154.148.235.443: Flags [.], seq 6910:8292, ack 49, win 1020, length 1382
2025-07-20 14:00:00.228677 IP 202.244.39.51.56172 > 13.154.148.235.443: Flags [.], seq 8292:9674, ack 49, win 1020, length 1382
2025-07-20 14:00:00.228678 IP 203.141.114.197 > 73.101.96.36: ICMP echo request, id 38370, seq 2724, length 12
2025-07-20 14:00:00.228693 IP 172.89.175.81.443 > 202.244.35.39.54604: Flags [.], ack 12709, win 11271, length 0
2025-07-20 14:00:00.228695 IP 203.141.114.197 > 88.113.120.125: ICMP echo request, id 38370, seq 2862, length 12
2025-07-20 14:00:00.228697 IP 150.165.96.231 > 210.189.103.181: [|ESP]
2025-07-20 14:00:00.228702 IP 203.141.98.100.38881 > 126.138.86.209.55989: UDP, length 96
2025-07-20 14:00:00.228705 IP 157.175.157.230.53 > 61.175.29.20.33818: 24740*-[|domain]
2025-07-20 14:00:00.228706 IP 221.158.77.22.18220 > 192.111.196.228.53: 17486% [1au][|domain]
2025-07-20 14:00:00.228707 IP6 2001:93f0:2f2:1d6d:407:c7f3:e801:d0.443 > 2001:fb37:5954:d506:682:4ed9:8f21:ed73.58136: Flags [.], seq 1548324376:1548329318, ack 2908301527, win 32812, length 4942
2025-07-20 14:00:00.228708 IP 67.245.12.55.56120 > 150.165.103.133.80: Flags [S], seq 3673739817, win 65535, options [mss 1432,sackOK,TS val 3076501252 ecr 0,nop,wscale 8], length 0
2025-07-20 14:00:00.228710 IP 142.251.42.66.443 > 150.165.247.21.46922: Flags [.], ack 1056693837, win 1041, options [nop,nop,TS val 4119683358 ecr 1556128906], length 0
2025-07-20 14:00:00.228711 IP 83.160.191.177.56391 > 150.165.57.49.51464: Flags [S], seq 2596710218, win 1024, length 0
2025-07-20 14:00:00.228712 IP 202.244.39.51.56172 > 13.154.148.235.443: Flags [.], seq 9674:12438, ack 49, win 1020, length 2764
2025-07-20 14:00:00.228715 IP 202.244.39.57.50045 > 52.119.74.42.3481: UDP, length 116
2025-07-20 14:00:00.228718 IP 47.123.148.136.20902 > 133.196.126.118.12133: Flags [S], seq 1764946960, win 61690, options [mss 1460,nop,wscale 8,nop,nop,sackOK], length 0
2025-07-20 14:00:00.228728 IP 60.150.220.177.4500 > 131.139.181.28.4500: [|isakmp]
2025-07-20 14:00:00.228731 IP 172.89.175.81.443 > 202.244.35.39.54604: Flags [.], ack 18357, win 11268, length 0
2025-07-20 14:00:00.228736 IP 64.229.161.31.26200 > 203.141.65.59.8842: Flags [S], seq 2107099727, win 35650, options [mss 1460], length 0
2025-07-20 14:00:00.228740 IP 150.165.35.59.15918 > 125.189.101.96.4932: UDP, length 1386
2025-07-20 14:00:00.228761 IP 172.89.175.81.443 > 202.244.35.39.54604: Flags [.], ack 21181, win 11274, length 0
2025-07-20 14:00:00.228769 IP 37.36.179.114.36994 > 157.175.160.107.22: Flags [P.], seq 2935634929:2935635013, ack 3062517929, win 501, options [nop,nop,TS val 2656118518 ecr 3113616198], length 84
2025-07-20 14:00:00.228771 IP6 2001:9e3f:1e1:39f8:bd8:fb0c:e9ff:5d96.48374 > 2620:8312:a13d:f7f1:8ff:7f3:17fe:d17d.873: Flags [.], ack 1, win 21975, options [nop,nop,TS val 167455205 ecr 3993455973,nop,nop,sack 3 [|tcp]>
2025-07-20 14:00:00.228773 IP6 2a00:13a7:6259:39f0:f445:3ff0:200:b005.53 > 2001:93f0:175:4599:35f:3c03:401:3c08.43822: 14725*-[|domain]
2025-07-20 14:00:00.228774 IP 150.165.17.177.65498 > 45.121.183.17.443: Flags [.], ack 1, win 16383, options [nop,nop,sack 4 {861643:870403}{784263:855803}{1461:383981}{750683:778423}], length 0
2025-07-20 14:00:00.228776 IP 150.165.17.177.65498 > 45.121.183.17.443: Flags [.], ack 1, win 16383, options [nop,nop,sack 4 {861643:871863}{784263:855803}{1461:383981}{750683:778423}], length 0
2025-07-20 14:00:00.228776 IP 150.165.17.177.62903 > 45.121.183.28.443: Flags [.], ack 1, win 4095, options [nop,nop,sack 4 {115341:137241}{1461:70081}{78841:110961}{74461:77381}], length 0
2025-07-20 14:00:00.228777 IP 150.165.17.177.65498 > 45.121.183.17.443: Flags [.], ack 1, win 16383, options [nop,nop,sack 4 {861643:873323}{784263:855803}{1461:383981}{750683:778423}], length 0
2025-07-20 14:00:00.228782 IP 100.194.30.199.65088 > 150.165.153.211.465: Flags [S], seq 0, win 65535, options [mss 1460], length 0
2025-07-20 14:00:00.228794 IP 176.173.133.98.41156 > 150.165.45.225.52401: Flags [S], seq 4014718853, win 65535, length 0
2025-07-20 14:00:00.228794 IP 172.89.175.81.443 > 202.244.35.39.54604: Flags [.], ack 26829, win 11274, length 0
2025-07-20 14:00:00.228806 IP 83.160.190.81.57187 > 133.196.91.27.16000: Flags [S], seq 3940918718, win 1024, length 0
2025-07-20 14:00:00.228807 IP 91.155.157.14.41620 > 202.250.187.253.80: Flags [S], seq 3874547675, win 65535, length 0
2025-07-20 14:00:00.228810 IP 157.175.104.21.587 > 185.230.30.60.49510: Flags [.], ack 2174617622, win 227, options [nop,nop,TS val 2876647467 ecr 142129580], length 0
2025-07-20 14:00:00.228817 IP 157.175.243.151.60138 > 163.77.104.33.443: Flags [.], ack 879452930, win 1023, length 0
2025-07-20 14:00:00.228821 IP 157.175.243.151.60138 > 163.77.104.33.443: Flags [.], ack 2721, win 1023, length 0
2025-07-20 14:00:00.228825 IP 157.175.243.151.60138 > 163.77.104.33.443: Flags [.], ack 5441, win 1023, length 0
2025-07-20 14:00:00.228828 IP 157.175.243.151.60138 > 163.77.104.33.443: Flags [.], ack 8161, win 1023, length 0
2025-07-20 14:00:00.228832 IP 172.89.175.81.443 > 202.244.35.39.54604: Flags [.], ack 29653, win 11274, length 0
2025-07-20 14:00:00.228845 IP 202.244.39.51.56172 > 13.154.148.235.443: Flags [.], seq 12438:13820, ack 49, win 1020, length 1382
2025-07-20 14:00:00.228849 IP 45.78.127.54.55288 > 150.165.182.173.80: Flags [S], seq 1132525227, win 1024, length 0
2025-07-20 14:00:00.228850 IP 157.175.243.151.60138 > 163.77.104.33.443: Flags [.], ack 13601, win 1023, length 0
2025-07-20 14:00:00.228855 IP 157.175.243.151.60138 > 163.77.104.33.443: Flags [.], ack 16321, win 1023, length 0
2025-07-20 14:00:00.228860 IP 157.175.243.151.60138 > 163.77.104.33.443: Flags [.], ack 21761, win 1023, length 0
2025-07-20 14:00:00.228863 IP 20.137.21.74.50195 > 203.141.28.243.7547: Flags [S], seq 2003795546, win 65535, length 0
2025-07-20 14:00:00.228866 IP 172.89.175.81.443 > 202.244.35.39.54604: Flags [.], ack 35301, win 11274, length 0
2025-07-20 14:00:00.228876 IP 133.200.19.220.8728 > 87.133.227.123.60019: Flags [R.], seq 0, ack 2961221194, win 0, length 0
2025-07-20 14:00:00.228879 IP 150.165.35.59.15918 > 125.189.101.96.4932: UDP, length 1386
2025-07-20 14:00:00.228882 IP 221.158.77.35.29062 > 192.111.196.228.53: 31491% [1au][|domain]
2025-07-20 14:00:00.228890 IP 157.175.121.224.53372 > 101.28.151.121.16285: UDP, length 122
2025-07-20 14:00:00.228891 IP 157.175.47.253.22 > 45.255.40.172.64572: Flags [P.], seq 3181257612:3181258692, ack 2058326315, win 133, length 1080
2025-07-20 14:00:00.228901 IP6 240a:8599:df9:317a:756c:3415:7199:9f07.59717 > 2001:93f0:175:e01:17e:f910:e9d1:5d87.443: Flags [.], ack 23294702, win 4096, length 0
2025-07-20 14:00:00.228902 IP 157.175.197.244.33382 > 204.190.226.74.443: Flags [.], ack 2351778149, win 1027, length 0
2025-07-20 14:00:00.228908 IP 172.89.175.81.443 > 202.244.35.39.54604: Flags [.], ack 39537, win 11274, length 0
2025-07-20 14:00:00.228910 IP 185.91.127.107.443 > 203.141.35.157.2080: Flags [S], seq 271746015, win 65535, options [mss 1460,nop,wscale 8,nop,nop,sackOK], length 0
2025-07-20 14:00:00.228911 IP 172.154.54.28.44092 > 202.35.237.55.43: Flags [.], ack 3294664639, win 498, options [nop,nop,TS val 1228205967 ecr 1278271428], length 0
2025-07-20 14:00:00.228912 IP 202.244.39.51.56172 > 13.154.148.235.443: Flags [.], seq 13820:15202, ack 49, win 1020, length 1382
2025-07-20 14:00:00.228917 IP 133.200.164.198.59202 > 151.151.15.61.7206: UDP, length 53
2025-07-20 14:00:00.228918 IP 202.244.39.51.56172 > 13.154.148.235.443: Flags [.], seq 15202:16584, ack 49, win 1020, length 1382
2025-07-20 14:00:00.228943 IP 150.165.4.3.62752 > 23.54.106.8.443: Flags [.], ack 2075494139, win 8255, options [nop,nop,TS val 3760861566 ecr 4293891812], length 0
2025-07-20 14:00:00.228944 IP 202.244.39.51.56172 > 13.154.148.235.443: Flags [.], seq 16584:19348, ack 49, win 1020, length 2764
2025-07-20 14:00:00.228945 IP 172.89.175.81.443 > 202.244.35.39.54604: Flags [.], ack 42361, win 11274, length 0
2025-07-20 14:00:00.228947 IP 170.138.178.97.443 > 202.244.39.224.54136: Flags [.], ack 2177820212, win 11, options [nop,nop,TS val 1491091386 ecr 2984943109], length 0
2025-07-20 14:00:00.228967 IP 74.157.254.141.43422 > 131.138.32.222.26503: UDP, length 246
2025-07-20 14:00:00.228968 IP6 240a:8599:df9:317a:756c:3415:7199:9f07.59718 > 2001:93f0:175:e01:17e:f910:e9d1:5d87.443: Flags [P.], seq 2263932183:2263932700, ack 2002261170, win 4096, length 517
2025-07-20 14:00:00.228970 IP 74.157.254.141.43422 > 131.138.32.222.26503: UDP, length 278
2025-07-20 14:00:00.228971 IP 74.157.254.141.43422 > 131.138.32.222.26503: UDP, length 182
2025-07-20 14:00:00.228977 IP 172.89.175.81.443 > 202.244.35.39.54604: Flags [.], ack 45185, win 11274, length 0
2025-07-20 14:00:00.228978 IP 157.175.121.236.39616 > 57.140.86.100.3478: UDP, length 42
2025-07-20 14:00:00.228981 IP 150.165.35.59.15918 > 125.189.101.96.4932: UDP, length 1386
2025-07-20 14:00:00.228982 IP 172.89.175.81.443 > 202.244.35.39.54604: Flags [.], ack 48009, win 11274, length 0
2025-07-20 14:00:00.228983 IP 202.244.39.51.56172 > 13.154.148.235.443: Flags [.], seq 19348:22112, ack 49, win 1020, length 2764
2025-07-20 14:00:00.228984 IP 204.188.203.178.55193 > 133.196.92.21.8080: Flags [S], seq 4211907869, win 65535, length 0
2025-07-20 14:00:00.229002 IP6 2001:9e3f:1e1:39f8:bd8:fb0c:e9ff:5d96.48374 > 2620:8312:a13d:f7f1:8ff:7f3:17fe:d17d.873: Flags [.], ack 1, win 21975, options [nop,nop,TS val 167455205 ecr 3993455973,nop,nop,sack 3 [|tcp]>
2025-07-20 14:00:00.229010 IP 172.89.175.81.443 > 202.244.35.39.54604: Flags [.], ack 50833, win 11274, length 0
2025-07-20 14:00:00.229016 IP 151.154.126.227.443 > 202.244.36.247.2521: Flags [.], seq 3671083525:3671095141, ack 3487071987, win 361, length 11616
2025-07-20 14:00:00.229020 IP 202.244.39.51.56172 > 13.154.148.235.443: Flags [.], seq 22112:23494, ack 49, win 1020, length 1382
2025-07-20 14:00:00.229022 IP 150.165.17.177.62903 > 45.121.183.28.443: Flags [.], ack 1, win 4095, options [nop,nop,sack 4 {115341:138701}{1461:70081}{78841:110961}{74461:77381}], length 0
2025-07-20 14:00:00.229023 IP 150.165.17.177.49160 > 45.121.183.21.443: Flags [.], ack 1403391506, win 32767, options [nop,nop,sack 4 {646781:648241}{594221:640941}{226301:404421}{534361:592761}], length 0
2025-07-20 14:00:00.229024 IP 157.175.121.234.17370 > 1.47.129.198.53: 59320+[|domain]
2025-07-20 14:00:00.229024 IP 151.154.126.227.443 > 202.244.36.247.2521: Flags [.], seq 11616:15972, ack 1, win 361, length 4356
2025-07-20 14:00:00.229026 IP 150.165.17.177.62903 > 45.121.183.28.443: Flags [.], ack 1, win 4095, options [nop,nop,sack 4 {115341:140161}{1461:70081}{78841:110961}{74461:77381}], length 0
2025-07-20 14:00:00.229028 IP 150.165.17.177.62903 > 45.121.183.28.443: Flags [.], ack 1, win 4095, options [nop,nop,sack 4 {115341:141621}{1461:70081}{78841:110961}{74461:77381}], length 0
2025-07-20 14:00:00.229034 IP6 2001:9ae0:9888:f7f7:ce7:fbf3:e01:ec27.53 > 2001:9e3f:1c0:c9cb:878:30c:fc01:6fc0.58326: 16508*-[|domain]
2025-07-20 14:00:00.229045 IP 172.89.175.81.443 > 202.244.35.39.54604: Flags [.], ack 53657, win 11268, length 0
2025-07-20 14:00:00.229050 IP 150.165.16.242.52967 > 43.38.119.231.10456: UDP, length 138
2025-07-20 14:00:00.229057 IP 202.235.16.193.31970 > 192.243.215.49.53: 15480% [1au][|domain]
2025-07-20 14:00:00.229058 IP 202.244.39.51.60381 > 170.138.178.97.443: Flags [P.], seq 3589089773:3589090994, ack 1428806969, win 253, length 1221
2025-07-20 14:00:00.229060 IP 157.175.121.234.29364 > 1.47.129.198.53: 10692+[|domain]
2025-07-20 14:00:00.229060 IP 150.165.17.177.49160 > 45.121.183.21.443: Flags [.], ack 1, win 32767, options [nop,nop,sack 4 {646781:649701}{594221:640941}{226301:404421}{534361:592761}], length 0
2025-07-20 14:00:00.229062 IP 150.165.17.177.49160 > 45.121.183.21.443: Flags [.], ack 1, win 32767, options [nop,nop,sack 4 {646781:651161}{594221:640941}{226301:404421}{534361:592761}], length 0
2025-07-20 14:00:00.229063 IP 150.165.17.177.49160 > 45.121.183.21.443: Flags [.], ack 1, win 32767, options [nop,nop,sack 4 {646781:652621}{594221:640941}{226301:404421}{534361:592761}], length 0
2025-07-20 14:00:00.229065 IP 150.165.17.177.49160 > 45.121.183.21.443: Flags [.], ack 1, win 32767, options [nop,nop,sack 4 {646781:654081}{594221:640941}{226301:404421}{534361:592761}], length 0
2025-07-20 14:00:00.229066 IP 150.165.17.177.49160 > 45.121.183.21.443: Flags [.], ack 1, win 32767, options [nop,nop,sack 4 {646781:655541}{594221:640941}{226301:404421}{534361:592761}], length 0
2025-07-20 14:00:00.229066 IP 172.89.175.53.443 > 131.138.89.37.61399: Flags [.], ack 2717963814, win 4281, length 0
2025-07-20 14:00:00.229068 IP 202.244.39.51.56172 > 13.154.148.235.443: Flags [.], seq 23494:27640, ack 49, win 1020, length 4146
2025-07-20 14:00:00.229072 IP 150.165.35.59.15918 > 125.189.101.96.4932: UDP, length 1386
2025-07-20 14:00:00.229073 IP 150.165.17.177.49160 > 45.121.183.21.443: Flags [.], ack 1, win 32767, options [nop,nop,sack 4 {646781:657001}{594221:640941}{226301:404421}{534361:592761}], length 0
2025-07-20 14:00:00.229074 IP 150.165.17.177.49160 > 45.121.183.21.443: Flags [.], ack 1, win 32767, options [nop,nop,sack 4 {646781:658461}{594221:640941}{226301:404421}{534361:592761}], length 0
2025-07-20 14:00:00.229075 IP6 2001:93f0:2f2:1d70:bc7:c00f:1c01:505e.57954 > 2620:82d4:a094:c008:f41f:3fff:fbff:43fa.53: 35025 [1au][|domain]
2025-07-20 14:00:00.229076 IP 202.244.39.51.56172 > 13.154.148.235.443: Flags [.], seq 27640:29022, ack 49, win 1020, length 1382
2025-07-20 14:00:00.229077 IP 150.165.17.177.49163 > 45.121.183.21.443: Flags [.], ack 2343571546, win 32767, options [nop,nop,sack 4 {424861:440921}{404421:416101}{372301:398581}{328501:366461}], length 0
2025-07-20 14:00:00.229078 IP 172.89.175.81.443 > 202.244.35.39.54604: Flags [.], ack 56481, win 11274, length 0
2025-07-20 14:00:00.229079 IP 202.244.39.51.56172 > 13.154.148.235.443: Flags [.], seq 29022:30404, ack 49, win 1020, length 1382
2025-07-20 14:00:00.229082 IP 172.89.175.81.443 > 202.244.35.39.54604: Flags [.], ack 59305, win 11274, length 0
2025-07-20 14:00:00.229084 IP 20.137.21.74.34941 > 203.141.2.211.7547: Flags [S], seq 3089659481, win 65535, length 0
2025-07-20 14:00:00.229091 IP6 2405:f707:300:cae2:233a:29ea:cdd1:f58d.50639 > 2001:93f0:2f2:1d6d:407:c7f3:e801:d0.443: Flags [.], ack 1076257076, win 8286, length 0
2025-07-20 14:00:00.229109 IP 172.89.175.81.443 > 202.244.35.39.54604: Flags [.], ack 62129, win 11268, length 0
2025-07-20 14:00:00.229113 IP 203.141.105.234 > 104.195.100.231: ICMP net 150.165.104.240 unreachable, length 36
2025-07-20 14:00:00.229122 IP 202.244.39.51.56172 > 13.154.148.235.443: Flags [.], seq 30404:34550, ack 49, win 1020, length 4146
2025-07-20 14:00:00.229124 IP 171.245.142.156.33313 > 202.35.237.55.43: Flags [S], seq 3557146761, win 65228, options [mss 1452,nop,wscale 7,sackOK,TS val 3296419078 ecr 0], length 0
2025-07-20 14:00:00.229127 IP 150.165.17.177.49160 > 45.121.183.21.443: Flags [.], ack 1, win 32767, options [nop,nop,sack 4 {646781:659921}{594221:640941}{226301:404421}{534361:592761}], length 0
2025-07-20 14:00:00.229129 IP 202.244.39.51.56172 > 13.154.148.235.443: Flags [.], seq 34550:35932, ack 49, win 1020, length 1382
2025-07-20 14:00:00.229132 IP 150.165.17.177.49160 > 45.121.183.21.443: Flags [.], ack 1, win 32767, options [nop,nop,sack 4 {646781:661381}{594221:640941}{226301:404421}{534361:592761}], length 0
2025-07-20 14:00:00.229134 IP 150.165.17.177.49160 > 45.121.183.21.443: Flags [.], ack 1, win 32767, options [nop,nop,sack 4 {646781:662841}{594221:640941}{226301:404421}{534361:592761}], length 0
2025-07-20 14:00:00.229139 IP 150.165.17.177.49163 > 45.121.183.21.443: Flags [.], ack 1, win 32767, options [nop,nop,sack 4 {424861:442381}{404421:416101}{372301:398581}{328501:366461}], length 0
2025-07-20 14:00:00.229142 IP 172.89.175.81.443 > 202.244.35.39.54604: Flags [.], ack 64597, win 11262, length 0
2025-07-20 14:00:00.229143 IP 150.165.17.177.49163 > 45.121.183.21.443: Flags [.], ack 1, win 32767, options [nop,nop,sack 4 {424861:443841}{404421:416101}{372301:398581}{328501:366461}], length 0
2025-07-20 14:00:00.229145 IP 150.165.17.177.49163 > 45.121.183.21.443: Flags [.], ack 1, win 32767, options [nop,nop,sack 4 {424861:445301}{404421:416101}{372301:398581}{328501:366461}], length 0
2025-07-20 14:00:00.229151 IP 150.165.17.177.49163 > 45.121.183.21.443: Flags [.], ack 1, win 32767, options [nop,nop,sack 4 {424861:446761}{404421:416101}{372301:398581}{328501:366461}], length 0
2025-07-20 14:00:00.229153 IP 150.165.17.177.49163 > 45.121.183.21.443: Flags [.], ack 1, win 32767, options [nop,nop,sack 4 {424861:448221}{404421:416101}{372301:398581}{328501:366461}], length 0
2025-07-20 14:00:00.229154 IP 150.165.17.177.49160 > 45.121.183.21.443: Flags [.], ack 1, win 32767, options [nop,nop,sack 4 {646781:664301}{594221:640941}{226301:404421}{534361:592761}], length 0
2025-07-20 14:00:00.229155 IP 150.165.17.177.49163 > 45.121.183.21.443: Flags [.], ack 1, win 32767, options [nop,nop,sack 4 {424861:449681}{404421:416101}{372301:398581}{328501:366461}], length 0
2025-07-20 14:00:00.229156 IP 150.165.17.177.49160 > 45.121.183.21.443: Flags [.], ack 1, win 32767, options [nop,nop,sack 4 {646781:665761}{594221:640941}{226301:404421}{534361:592761}], length 0
2025-07-20 14:00:00.229157 IP 150.165.17.177.49163 > 45.121.183.21.443: Flags [.], ack 1, win 32767, options [nop,nop,sack 4 {424861:451141}{404421:416101}{372301:398581}{328501:366461}], length 0
2025-07-20 14:00:00.229159 IP 150.165.17.177.49160 > 45.121.183.21.443: Flags [.], ack 1, win 32767, options [nop,nop,sack 4 {646781:667221}{594221:640941}{226301:404421}{534361:592761}], length 0
2025-07-20 14:00:00.229160 IP 150.165.17.177.49160 > 45.121.183.21.443: Flags [.], ack 1, win 32767, options [nop,nop,sack 4 {646781:668681}{594221:640941}{226301:404421}{534361:592761}], length 0
2025-07-20 14:00:00.229161 IP 150.165.17.177.49160 > 45.121.183.21.443: Flags [.], ack 1, win 32767, options [nop,nop,sack 4 {646781:670141}{594221:640941}{226301:404421}{534361:592761}], length 0
2025-07-20 14:00:00.229162 IP 202.244.39.51.56172 > 13.154.148.235.443: Flags [P.], seq 35932:38696, ack 49, win 1020, length 2764
2025-07-20 14:00:00.229174 IP 172.89.175.81.443 > 202.244.35.39.54604: Flags [.], ack 67421, win 11256, length 0
2025-07-20 14:00:00.229177 IP 203.141.93.8.55756 > 3.141.230.117.443: Flags [P.], seq 164715039:164715556, ack 3419904984, win 1825, options [nop,nop,TS val 3467790255 ecr 3583794866], length 517
2025-07-20 14:00:00.229178 IP 172.89.175.81.443 > 202.244.35.39.54604: Flags [.], ack 70245, win 11250, length 0
2025-07-20 14:00:00.229184 IP 162.96.2.166.1940 > 202.250.171.153.9142: Flags [S], seq 1908126293, win 42340, options [mss 1460,sackOK,TS val 1750778555 ecr 0,nop,wscale 10], length 0
2025-07-20 14:00:00.229185 IP 172.89.175.53.443 > 131.138.89.37.61399: Flags [.], ack 1413, win 4292, length 0
2025-07-20 14:00:00.229188 IP 202.244.39.51.56172 > 13.154.148.235.443: Flags [.], seq 38696:41460, ack 49, win 1020, length 2764
2025-07-20 14:00:00.229190 IP 141.64.198.255 > 203.141.114.197: ICMP echo reply, id 39906, seq 649, length 12
2025-07-20 14:00:00.229191 IP 202.244.39.51.56172 > 13.154.148.235.443: Flags [.], seq 41460:42842, ack 49, win 1020, length 1382
2025-07-20 14:00:00.229192 IP 212.39.9.149.443 > 150.165.80.98.65338: UDP, length 1312
2025-07-20 14:00:00.229197 IP 212.39.9.149.443 > 150.165.80.98.65338: UDP, length 1312
2025-07-20 14:00:00.229206 IP 157.175.61.213.30494 > 20.2.82.73.443: Flags [.], ack 1237925953, win 2040, options [nop,nop,TS val 629921938 ecr 2532501975], length 0
2025-07-20 14:00:00.229207 IP 207.164.252.53.26200 > 203.141.56.124.21515: Flags [S], seq 1277706175, win 41704, options [mss 1460], length 0
2025-07-20 14:00:00.229210 IP 172.89.175.81.443 > 202.244.35.39.54604: Flags [.], ack 73069, win 11244, length 0
2025-07-20 14:00:00.229217 IP 202.244.39.51.56172 > 13.154.148.235.443: Flags [.], seq 42842:45606, ack 49, win 1020, length 2764
2025-07-20 14:00:00.229228 IP 150.165.103.133.56200 > 185.125.65.37.873: Flags [.], ack 1981842126, win 32851, options [nop,nop,TS val 551892086 ecr 1467266512], length 0
2025-07-20 14:00:00.229230 IP6 2001:93f0:2f2:8a0d:c3c0:a497:ef3e:1b22.52218 > 2600:9d2a:ea3f:f9fa:8e7:c70c:b814:7ddd.443: Flags [.], ack 1809, win 8222, length 0
2025-07-20 14:00:00.229234 IP 163.61.15.112.50116 > 91.99.181.56.443: Flags [.], ack 1678834249, win 65535, options [nop,nop,TS val 3769781502 ecr 1274769631], length 0
2025-07-20 14:00:00.229236 IP 203.141.96.220.51477 > 44.102.129.34.443: Flags [.], ack 369973671, win 1026, options [nop,nop,TS val 95382635 ecr 1094755298], length 0
2025-07-20 14:00:00.229239 IP 157.175.18.96.51008 > 162.130.246.227.443: Flags [.], seq 6:1543, ack 1, win 2050, options [nop,nop,TS val 114140101 ecr 3734486836], length 1537
2025-07-20 14:00:00.229240 IP 172.89.175.81.443 > 202.244.35.39.54604: Flags [.], ack 78717, win 11274, length 0
2025-07-20 14:00:00.229251 IP 202.244.39.51.56172 > 13.154.148.235.443: Flags [.], seq 45606:49752, ack 49, win 1020, length 4146
2025-07-20 14:00:00.229259 IP 203.141.114.197 > 88.223.215.28: ICMP echo request, id 38370, seq 4597, length 12
2025-07-20 14:00:00.229260 IP 203.141.114.197 > 177.188.91.5: ICMP echo request, id 38370, seq 4597, length 12
2025-07-20 14:00:00.229263 IP 203.141.114.197 > 54.53.113.30: ICMP echo request, id 39906, seq 4681, length 12
2025-07-20 14:00:00.229264 IP 13.154.148.235.443 > 202.244.39.51.56172: Flags [.], ack 4294806984, win 49152, length 0
2025-07-20 14:00:00.229265 IP 203.141.114.197 > 220.210.215.143: ICMP echo request, id 42466, seq 4830, length 12
2025-07-20 14:00:00.229267 IP 203.141.114.197 > 188.113.214.243: ICMP echo request, id 41186, seq 2869, length 12
2025-07-20 14:00:00.229269 IP 203.141.114.197 > 61.253.92.134: ICMP echo request, id 42466, seq 4830, length 12
2025-07-20 14:00:00.229271 IP6 2001:9e3f:1e1:39f8:bd8:fb0c:e9ff:5d96.48374 > 2620:8312:a13d:f7f1:8ff:7f3:17fe:d17d.873: Flags [.], ack 1, win 21975, options [nop,nop,TS val 167455208 ecr 3993455973,nop,nop,sack 3 [|tcp]>
2025-07-20 14:00:00.229280 IP 203.141.114.197 > 38.41.14.87: ICMP echo request, id 39906, seq 4681, length 12
2025-07-20 14:00:00.229283 IP 172.89.175.53.443 > 131.138.89.37.61399: Flags [.], ack 2825, win 4303, length 0
2025-07-20 14:00:00.229286 IP 202.244.39.51.56172 > 13.154.148.235.443: Flags [.], seq 49752:52516, ack 49, win 1020, length 2764
2025-07-20 14:00:00.229289 IP 203.141.114.197 > 75.114.73.102: ICMP echo request, id 39906, seq 4681, length 12
2025-07-20 14:00:00.229291 IP 202.244.39.51.56172 > 13.154.148.235.443: Flags [.], seq 52516:53898, ack 49, win 1020, length 1382
2025-07-20 14:00:00.229295 IP 203.141.114.197 > 187.56.104.173: ICMP echo request, id 41186, seq 4689, length 12
2025-07-20 14:00:00.229296 IP 150.165.17.177.49163 > 45.121.183.21.443: Flags [.], ack 1, win 32767, options [nop,nop,sack 4 {424861:452601}{404421:416101}{372301:398581}{328501:366461}], length 0
2025-07-20 14:00:00.229299 IP 150.165.17.177.65498 > 45.121.183.17.443: Flags [.], ack 1, win 16383, options [nop,nop,sack 4 {420481:531441}{861643:873323}{784263:855803}{1461:383981}], length 0
2025-07-20 14:00:00.229300 IP 203.141.114.197 > 78.102.161.118: ICMP echo request, id 39906, seq 4681, length 12
2025-07-20 14:00:00.229301 IP 13.154.148.235.443 > 202.244.39.51.56172: Flags [.], ack 4294808366, win 49152, length 0
2025-07-20 14:00:00.229302 IP 150.165.17.177.65498 > 45.121.183.17.443: Flags [.], ack 1, win 16383, options [nop,nop,sack 4 {420481:532901}{861643:873323}{784263:855803}{1461:383981}], length 0
2025-07-20 14:00:00.229303 IP 150.165.17.177.65498 > 45.121.183.17.443: Flags [.], ack 1, win 16383, options [nop,nop,sack 4 {420481:534361}{861643:873323}{784263:855803}{1461:383981}], length 0
2025-07-20 14:00:00.229305 IP 150.165.17.177.65498 > 45.121.183.17.443: Flags [.], ack 1, win 16383, options [nop,nop,sack 4 {420481:535821}{861643:873323}{784263:855803}{1461:383981}], length 0
2025-07-20 14:00:00.229305 IP 172.89.175.81.443 > 202.244.35.39.54604: Flags [.], ack 82953, win 11265, length 0
2025-07-20 14:00:00.229306 IP 133.200.143.68.62984 > 52.105.37.42.443: Flags [.], ack 2350836992, win 255, length 0
2025-07-20 14:00:00.229315 IP 150.165.4.3.62752 > 23.54.106.8.443: Flags [.], ack 5597, win 8255, options [nop,nop,TS val 3760861569 ecr 4293891812], length 0
2025-07-20 14:00:00.229318 IP 202.244.39.51.56172 > 13.154.148.235.443: Flags [.], seq 53898:56662, ack 49, win 1020, length 2764
2025-07-20 14:00:00.229331 IP 150.165.17.174.62337 > 155.104.241.193.80: Flags [.], ack 664277742, win 8179, length 0
2025-07-20 14:00:00.229332 IP6 2600:96e6:df01:ccd:c1f:3:3ff:9ff8.443 > 2001:93f0:175:3bef:4dd:7589:d400:7627.57276: UDP, length 538
2025-07-20 14:00:00.229335 IP 45.121.183.21.443 > 150.165.17.177.49163: Flags [.], seq 366461:372301, ack 0, win 2623, length 5840
2025-07-20 14:00:00.229336 IP 13.154.148.235.443 > 202.244.39.51.56172: Flags [.], ack 4294811130, win 49152, length 0
2025-07-20 14:00:00.229338 IP 172.89.175.81.443 > 202.244.35.39.54604: Flags [.], ack 87189, win 11271, length 0
2025-07-20 14:00:00.229347 IP 45.121.183.17.443 > 150.165.17.177.65498: Flags [.], seq 855803:861643, ack 0, win 2598, length 5840
2025-07-20 14:00:00.229348 IP 142.250.223.109.443 > 202.244.39.49.52272: Flags [.], ack 4288307577, win 1024, options [nop,nop,TS val 3818334641 ecr 737350015], length 0
2025-07-20 14:00:00.229350 IP 202.244.39.51.56172 > 13.154.148.235.443: Flags [.], seq 56662:60808, ack 49, win 1020, length 4146
2025-07-20 14:00:00.229350 IP 133.200.164.238.55929 > 113.36.58.173.51198: UDP, length 294
2025-07-20 14:00:00.229361 IP 162.59.126.150.55194 > 150.165.212.128.63256: Flags [S], seq 288651381, win 65535, options [mss 1460], length 0
2025-07-20 14:00:00.229366 IP 13.154.148.235.443 > 202.244.39.51.56172: Flags [.], ack 4294813894, win 49152, length 0
2025-07-20 14:00:00.229371 IP 172.89.175.81.443 > 202.244.35.39.54604: Flags [.], ack 91425, win 11262, length 0
2025-07-20 14:00:00.229377 IP 45.121.183.21.443 > 150.165.17.177.49160: Flags [.], seq 967981:969441, ack 0, win 2438, length 1460
2025-07-20 14:00:00.229380 IP 157.175.59.57.38772 > 92.95.207.65.80: Flags [.], ack 1225982841, win 29, options [nop,nop,TS val 973121 ecr 4128368584], length 0
2025-07-20 14:00:00.229381 IP 133.200.164.238.55929 > 113.36.58.173.51198: UDP, length 59
2025-07-20 14:00:00.229382 IP 202.244.39.51.56172 > 13.154.148.235.443: Flags [.], seq 60808:63572, ack 49, win 1020, length 2764
2025-07-20 14:00:00.229384 IP 45.121.183.21.443 > 150.165.17.177.49160: Flags [.], seq 969441:972361, ack 0, win 2438, length 2920
2025-07-20 14:00:00.229385 IP 133.200.164.238.55929 > 113.36.58.173.51198: UDP, length 61
2025-07-20 14:00:00.229385 IP 122.112.105.88 > 203.141.114.197: ICMP echo reply, id 41186, seq 60, length 12
2025-07-20 14:00:00.229388 IP 45.121.183.21.443 > 150.165.17.177.49160: Flags [.], seq 972361:975281, ack 0, win 2438, length 2920
2025-07-20 14:00:00.229391 IP 45.121.183.21.443 > 150.165.17.177.49160: Flags [.], seq 975281:976741, ack 0, win 2438, length 1460
2025-07-20 14:00:00.229391 IP6 2620:8312:a13d:f7f1:8ff:7f3:17fe:d17d.873 > 2001:9e3f:1e1:39f8:bd8:fb0c:e9ff:5d96.48374: Flags [.], seq 926773:929629, ack 0, win 1100, options [nop,nop,TS val 3993456049 ecr 167455040], length 2856
2025-07-20 14:00:00.229394 IP 157.175.121.242.30692 > 157.12.15.0.443: Flags [.], seq 3872834776:3872837536, ack 1071314758, win 300, options [nop,nop,TS val 2911586401 ecr 3952860872], length 2760
2025-07-20 14:00:00.229394 IP 45.121.183.21.443 > 150.165.17.177.49160: Flags [.], seq 976741:979661, ack 0, win 2438, length 2920
2025-07-20 14:00:00.229396 IP 13.154.148.235.443 > 202.244.39.51.56172: Flags [.], seq 1633:1681, ack 4294818040, win 49152, length 48
2025-07-20 14:00:00.229399 IP 45.121.183.21.443 > 150.165.17.177.49160: Flags [.], seq 979661:985501, ack 0, win 2438, length 5840
2025-07-20 14:00:00.229403 IP 172.89.175.81.443 > 202.244.35.39.54604: Flags [.], ack 94249, win 11256, length 0
2025-07-20 14:00:00.229404 IP 45.121.183.21.443 > 150.165.17.177.49160: Flags [.], seq 985501:989881, ack 0, win 2438, length 4380
2025-07-20 14:00:00.229408 IP 45.121.183.21.443 > 150.165.17.177.49160: Flags [P.], seq 989881:991341, ack 0, win 2438, length 1460
2025-07-20 14:00:00.229416 IP 206.40.94.66.59436 > 150.165.106.98.61257: Flags [S], seq 930199088, win 42340, options [mss 1460,sackOK,TS val 1750778553 ecr 0,nop,wscale 10], length 0
2025-07-20 14:00:00.229419 IP 74.130.21.101.443 > 150.165.80.251.51230: UDP, length 282
2025-07-20 14:00:00.229420 IP 172.89.175.53.443 > 131.138.89.37.61399: Flags [.], ack 4237, win 4314, length 0
2025-07-20 14:00:00.229422 IP 202.244.39.51.56172 > 13.154.148.235.443: Flags [.], seq 63572:67718, ack 49, win 1020, length 4146
2025-07-20 14:00:00.229424 IP 126.166.19.112.4500 > 133.200.88.200.4500: [|isakmp]
2025-07-20 14:00:00.229426 IP 150.165.35.59.15918 > 125.189.101.96.4932: UDP, length 1386
2025-07-20 14:00:00.229428 IP 35.47.109.250.6962 > 203.141.98.95.443: Flags [P.], seq 4045276301:4045276307, ack 1493522860, win 473, options [nop,nop,TS val 3289780342 ecr 3000818362], length 6
2025-07-20 14:00:00.229429 IP 150.165.35.59.15918 > 125.189.101.96.4932: UDP, length 1386
2025-07-20 14:00:00.229431 IP 202.244.39.51.56172 > 13.154.148.235.443: Flags [P.], seq 67718:69100, ack 49, win 1020, length 1382
2025-07-20 14:00:00.229432 IP 13.154.148.235.443 > 202.244.39.51.56172: Flags [.], ack 4294822186, win 49152, length 0
2025-07-20 14:00:00.229436 IP 172.89.175.81.443 > 202.244.35.39.54604: Flags [.], ack 97073, win 11250, length 0
2025-07-20 14:00:00.229437 IP 13.154.148.235.443 > 202.244.39.51.56172: Flags [.], ack 4294823568, win 49152, length 0
2025-07-20 14:00:00.229446 IP 202.244.39.51.56172 > 13.154.148.235.443: Flags [.], seq 69100:70482, ack 49, win 1020, length 1382
2025-07-20 14:00:00.229450 IP 202.244.39.51.56172 > 13.154.148.235.443: Flags [.], seq 70482:71864, ack 49, win 1020, length 1382
2025-07-20 14:00:00.229452 IP 157.175.121.242.30692 > 157.12.15.0.443: Flags [.], seq 2760:4140, ack 1, win 300, options [nop,nop,TS val 2911586401 ecr 3952860872], length 1380
2025-07-20 14:00:00.229459 IP 134.132.5.160.33304 > 203.141.10.123.3392: Flags [S], seq 3904937536, win 65535, options [mss 1460,sackOK,TS val 3489816036 ecr 0,nop,wscale 7], length 0
2025-07-20 14:00:00.229462 IP 203.141.114.197 > 72.101.129.255: ICMP echo request, id 41186, seq 4689, length 12
2025-07-20 14:00:00.229465 IP 35.47.109.250.6962 > 203.141.98.95.443: Flags [P.], seq 6:51, ack 1, win 473, options [nop,nop,TS val 3289780342 ecr 3000818362], length 45
